difficulty,question,choice_a,choice_b,choice_c,choice_d,correct_choice,explanation,concept_key,aspect_key,source_path
medium,How does NAT allow a private internal network to communicate with the internet when private IP addresses are not routable on the public internet?,NAT converts private IP addresses to IPv6 addresses which are routable globally,NAT assigns a separate public IP address to every internal host from a large pool of public IPs,NAT at the router substitutes its own public IP as the source address when internal packets leave and reverses the substitution when replies return,NAT encrypts private IP addresses into a VPN header that internet routers can forward without knowing the internal addressing scheme,C,Private IP ranges (10.x; 172.16-31.x; 192.168.x) are not routable on the internet. When an internal host sends a packet outbound NAT replaces the private source IP with the router's public IP. The router tracks the session and when the reply comes back it substitutes the original private IP and forwards inward.,nat sender substitution,nat replaces private source ip with public router ip enabling internet communication,/home/citadel/Documents/citavault/NETC-121/Notes List B - Textbook Content/Textbook 1 - Chapter 3 Switches, Routers, and VLANs/Book 1 Chapter 3 - Switches, Routers, and VLANs.md
medium,What is the VLAN hopping threat model and what makes DTP auto mode the enabling vulnerability?,VLAN hopping exploits STP to block ports selectively; DTP auto mode creates loop conditions that allow reachability across VLANs,DTP auto mode causes ARP floods that allow attackers to intercept inter-VLAN routed traffic,An attacker connects a device that speaks DTP; auto mode allows the port to negotiate to trunk mode giving the attacker tagged access to all VLANs — disabled by hard-coding access mode,DTP auto mode encrypts traffic weakly; attackers decode the encryption to access any VLAN's traffic without needing trunk access,C,VLAN hopping threat: attacker plugs in a device that sends DTP negotiate frames. The switch port in auto mode accepts and forms a trunk. The attacker can now send and receive 802.1Q-tagged frames for any VLAN on that trunk. Hard-coding switchport mode access disables DTP completely on that port.,vlan hopping attack,dtp auto mode enables vlan hopping by allowing attackers to negotiate trunk access,/home/citadel/Documents/citavault/NETC-121/Notes List B - Textbook Content/Textbook 1 - Chapter 3 Switches, Routers, and VLANs/Book 1 Chapter 3 - Switches, Routers, and VLANs.md
medium,Why does MAC-based forwarding still matter on a routed network even though routers use IP addresses?,Once a router makes the IP routing decision the packet is still encapsulated in an Ethernet frame and local delivery on each segment depends on MAC addresses to reach the next hop,MAC addresses are only relevant inside the router CPU for looking up the routing table; the Ethernet frame is discarded before the routing decision,Routed networks replace MAC addresses with IP addresses at every hop so MAC is irrelevant beyond the first switch,MAC addresses are used by the router to encrypt packet payloads before forwarding them between subnets,A,Routing decides which interface and next-hop to use (IP decision). But the actual frame sent on the local Ethernet segment must have the next-hop's MAC as the destination. ARP resolves the next-hop IP to a MAC. This Layer 2 delivery happens at every hop along the routed path.,mac still matters in routed networks,local ethernet delivery still uses mac addresses even when routing by ip,/home/citadel/Documents/citavault/NETC-121/Notes List B - Textbook Content/Textbook 1 - Chapter 3 Switches, Routers, and VLANs/Book 1 Chapter 3 - Switches, Routers, and VLANs.md
medium,What are the three core switch behaviors described in Chapter 3 and what triggers each one?,Routing; bridging; and switching — triggered by IP address lookup; MAC address lookup; and VLAN ID respectively,Encrypting; decrypting; and forwarding — triggered by VPN negotiation; key exchange; and session establishment,Learning; forwarding; and flooding — triggered by reading source MAC; destination MAC in table; and destination MAC unknown,Trunking; tagging; and forwarding — triggered by DTP negotiation; 802.1Q insertion; and VLAN lookup,C,Three core switch behaviors: (1) Learning — triggered by any incoming frame; switch reads source MAC and ingress port into MAC table; (2) Forwarding — triggered when destination MAC is in the table; switch sends frame to the learned port only; (3) Flooding — triggered when destination MAC is unknown; switch sends to all ports except ingress.,three basic switch functions,learning from source mac; forwarding to known destination; flooding for unknown,/home/citadel/Documents/citavault/NETC-121/Notes List B - Textbook Content/Textbook 1 - Chapter 3 Switches, Routers, and VLANs/Book 1 Chapter 3 - Switches, Routers, and VLANs.md
medium,Why does connecting two switches together via trunks extend the broadcast domain across both switches?,Trunking creates a Layer 3 path between switches causing routed broadcasts to propagate,Trunking merges the MAC tables of both switches into one shared forwarding database,Switches forward broadcasts to all ports in the same VLAN; with a trunk link frames tagged for a VLAN cross from one switch to the other so both switches' ports in that VLAN are in the same broadcast domain,Trunking causes both switches to replicate all broadcast frames to every attached VLAN regardless of port assignment,C,Without a router or VLAN segmentation broadcast frames flood through trunk links. A broadcast from Host A on SW1 enters VLAN 1; the switch floods it out all VLAN 1 ports including the trunk to SW2; SW2 floods it out all its VLAN 1 ports. All hosts in VLAN 1 across both switches receive it.,switch broadcast behavior,trunk links propagate broadcasts across switches extending the broadcast domain,/home/citadel/Documents/citavault/NETC-121/Notes List B - Textbook Content/Textbook 1 - Chapter 3 Switches, Routers, and VLANs/Book 1 Chapter 3 - Switches, Routers, and VLANs.md
medium,A virtualization server with multiple VMs needs each VM on a different VLAN. What switch configuration allows this on one physical NIC?,Configure each VM as a separate physical device and connect each to its own switch access port using virtual cables,Enable STP on the server's NIC so spanning tree can dynamically assign VLANs to each VM,Configure a trunk link between the switch and the server's NIC; the hypervisor uses 802.1Q tagging to assign each VM to its VLAN,Configure the server NIC as an access port in one VLAN and use NAT on the server to translate between VM subnets,C,A virtualization server NIC on a trunk link receives 802.1Q-tagged frames. The hypervisor (VMware; Hyper-V; etc.) reads the VLAN tag and forwards the frame to the correct virtual machine. Each VM belongs to a VLAN without needing a separate physical NIC.,server trunk use case,trunk to server lets hypervisor use 802.1q tags to place each vm in a vlan,/home/citadel/Documents/citavault/NETC-121/Notes List A - Video Content/Video 17 - Trunking and 802.1Q/Transcript.md
medium,How does a switch handle a frame with a known destination MAC that is reachable through a port leading to another switch?,The switch drops the frame because only direct access-port destinations are supported,The switch looks up the destination MAC in its MAC table; finds it associated with the uplink port leading to the other switch; and forwards the frame only out that port,The switch floods the frame because it cannot confirm the destination is reachable through the uplink without an ARP reply,The switch creates a new trunk session to the other switch before forwarding the frame,B,The MAC table maps destination MACs to egress ports. If the destination host is behind another switch the MAC is associated with the uplink port. The switch forwards the frame only out that port and it is the job of the next switch to deliver it further.,multiple macs on one port,switch forwards to uplink port when destination mac is reachable through another switch,/home/citadel/Documents/citavault/NETC-121/Notes List B - Textbook Content/Textbook 1 - Chapter 3 Switches, Routers, and VLANs/Book 1 Chapter 3 - Switches, Routers, and VLANs.md
medium,What is the functional difference between the VTP server and VTP client roles?,The VTP server creates the VLAN database and the VTP client provides Layer 3 routing for inter-VLAN traffic,The VTP server runs one spanning-tree instance per VLAN while the VTP client runs one instance for all VLANs combined,VTP server and client have no functional difference; the terms only describe which switch was configured first,The VTP server creates and modifies the VLAN database and advertises it to VTP clients; VTP clients accept updates and store them but cannot make changes to the VLAN database,D,VTP server: administrator creates; modifies; and deletes VLANs here. Changes are advertised to all VTP clients in the same domain. VTP client: receives and applies VLAN database updates but cannot independently create or modify VLANs.,vtp,vtp server creates vlans and advertises to clients who cannot modify the database,/home/citadel/Documents/citavault/NETC-121/Notes List B - Textbook Content/Textbook 1 - Chapter 3 Switches, Routers, and VLANs/Book 1 Chapter 3 - Switches, Routers, and VLANs.md
medium,A host in VLAN 30 needs to reach the internet. Describe the Layer 2 and Layer 3 handoff that must occur.,The host sends a Layer 2 frame directly to the internet server's MAC address and the switch routes it to the internet based on VLAN ID,The switch routes the packet based on the destination IP from VLAN 30 to the internet without a router,The host sends an ARP for the destination IP; the switch responds; and the frame is forwarded directly across VLANs without routing,The host sends traffic with the router's gateway IP as destination IP; the switch forwards it as Layer 2 within VLAN 30 to the router interface; the router strips Layer 2 and routes the IP packet toward the internet,D,Process: (1) host builds an IP packet to the internet destination; (2) host ARP-resolves the default gateway IP to get the router's MAC; (3) host sends an Ethernet frame with router MAC as destination within VLAN 30; (4) switch forwards it within VLAN 30 to the router port; (5) router strips L2; makes IP routing decision; sends outbound; NAT rewrites source IP.,basic routed path logic,host uses gateway mac to send frame to router within vlan then router routes ip packet,/home/citadel/Documents/citavault/NETC-121/Notes List B - Textbook Content/Textbook 1 - Chapter 3 Switches, Routers, and VLANs/Book 1 Chapter 3 - Switches, Routers, and VLANs.md
medium,What is the VLAN hopping security risk unique to the native VLAN when trunk negotiation is exploited?,The native VLAN carries BPDUs which an attacker can intercept to modify STP topology,Native VLAN frames are untagged on trunk links; an attacker can inject untagged frames that a switch forwards into the native VLAN bypassing VLAN access controls,The native VLAN is always VLAN 1 which is also the management VLAN; hopping gives the attacker switch management access automatically,The native VLAN frames are encrypted with a weaker cipher making them easier to intercept,B,802.1Q native VLAN traffic is sent untagged on trunk links. If the attacker sends an untagged frame from a port in the same native VLAN it enters that VLAN without any explicit tagging. If native VLANs are mismatched an attacker can also use double-tagging to reach another VLAN. Best practice: change the native VLAN to an unused VLAN.,vlan hopping attack,native vlan untagged frames can be injected bypassing vlan access controls,/home/citadel/Documents/citavault/NETC-121/Notes List B - Textbook Content/Textbook 1 - Chapter 3 Switches, Routers, and VLANs/Book 1 Chapter 3 - Switches, Routers, and VLANs.md
medium,A network has grown large enough that ARP broadcasts and other overhead are significantly slowing performance. What is the most scalable solution?,Replace all switches with hubs to reduce broadcast storms by eliminating the MAC table,Add more routers and set every device to a static ARP entry to eliminate broadcasts,Segment the network with VLANs and routers to create smaller broadcast domains reducing the number of devices each broadcast reaches,Upgrade all switch ports to 10 Gbps so broadcasts consume a smaller percentage of available bandwidth,C,Each VLAN is its own broadcast domain. Splitting a flat network into multiple VLANs means ARP and other broadcasts only reach the devices within that VLAN. The total broadcast overhead each device processes drops significantly. Routers connect VLANs for inter-VLAN communication.,broadcast overhead problem,vlans reduce broadcast domains so each device processes fewer broadcasts,/home/citadel/Documents/citavault/NETC-121/Notes List A - Video Content/Video 16 - VLANs Made Easy/Transcript.md
medium,How does a bridge perform media conversion and what modern network role does it fill?,Bridges convert between IPv4 and IPv6 address formats to connect legacy and modern subnets,Bridges regenerate electrical signals between two cable segments; modern switches still use this for PoE delivery,Bridges can connect different media types (copper on one side; fiber on the other) forwarding frames by MAC; modern switches are essentially multiport bridges fulfilling this same function,Bridges translate between 802.1Q and ISL encapsulation; modern switches still perform this translation for legacy devices,C,A bridge connects different network media types (e.g. copper to fiber) and makes forwarding decisions based on MAC addresses. Modern multiport switches are the direct evolution of bridges — they do the same MAC-based forwarding with many more ports and higher speed.,bridge media conversion role,bridges connect different media by mac forwarding; switches are multiport bridges,/home/citadel/Documents/citavault/NETC-121/Notes List B - Textbook Content/Textbook 1 - Chapter 3 Switches, Routers, and VLANs/Book 1 Chapter 3 - Switches, Routers, and VLANs.md
medium,Why does adding more devices to a hub-based shared Ethernet segment degrade performance non-linearly?,Every device added increases collisions exponentially because the probability of two devices transmitting simultaneously rises with each additional sender competing for the same medium,Hub performance degrades linearly; each additional device reduces total throughput by exactly one share of total bandwidth,More devices cause the hub to enable rate limiting on all ports to prevent overload,Hub performance degrades because each device added causes the hub to add a processing delay proportional to port count,A,Collision probability grows with the number of competing transmitters. With two devices collisions are rare. With many devices collisions are frequent; after each collision all parties back off and retry; causing more collisions in a feedback loop. This is why hubs scaled badly and why switches replaced them.,why shared ethernet scaled badly,more hub devices increase collision probability and cause non-linear performance degradation,/home/citadel/Documents/citavault/NETC-121/Notes List B - Textbook Content/Textbook 1 - Chapter 3 Switches, Routers, and VLANs/Book 1 Chapter 3 - Switches, Routers, and VLANs.md
medium,What is the difference between a remote-access VPN and a site-to-site VPN in terms of endpoints and use case?,Remote-access VPN connects two switches at different sites; site-to-site VPN connects a single user device to the corporate network,Both VPN types are identical in topology; they differ only in the encryption protocol used,Remote-access VPN connects an individual device to the corporate network for a mobile or home worker; site-to-site VPN persistently connects two entire office networks through an encrypted tunnel,Site-to-site VPN is for temporary access during meetings; remote-access VPN is a permanent inter-office connection,C,Remote-access VPN: a single user's device (laptop; phone) connects to the corporate VPN concentrator. Useful for traveling employees or remote workers. Site-to-site VPN: a router at each office builds a persistent encrypted tunnel so all devices at both sites can reach each other as if on the same network.,vpn use cases,remote-access connects one device to corporate; site-to-site connects two office networks,/home/citadel/Documents/citavault/NETC-121/Notes List B - Textbook Content/Textbook 1 - Chapter 3 Switches, Routers, and VLANs/Book 1 Chapter 3 - Switches, Routers, and VLANs.md
medium,A switch has the following MAC table: port 1 = A1; port 2 = B2; port 3 = C3. A frame arrives on port 1 with source A1 and destination D4 which is unknown. What does the switch do?,Update the MAC table with D4 on port 1 and send the frame to port 1,Drop the frame because D4 is not in the MAC table and flooding is disabled by default,Flood the frame out ports 2 and 3 only and learn A1 on port 1,Forward the frame only to port 3 because C3 is the closest alphabetical match to D4,C,The switch processes the incoming frame: (1) Learning — source A1 is already known on port 1; no update needed; (2) Forwarding decision — D4 is not in the MAC table; (3) Flooding — switch floods out all ports except ingress port 1; so the frame goes to ports 2 and 3.,flooding definition,unknown destination mac triggers flooding out all ports except ingress,/home/citadel/Documents/citavault/NETC-121/Notes List B - Textbook Content/Textbook 1 - Chapter 3 Switches, Routers, and VLANs/Book 1 Chapter 3 - Switches, Routers, and VLANs.md
medium,What is the security argument for using SSH instead of Telnet even when managing a device on an internal trusted network?,SSH is required by Cisco IOS and Telnet is disabled by default so there is no practical choice,SSH provides authentication while Telnet does not authenticate the user at all,Internal networks still carry traffic that can be captured by compromised hosts; SSH encrypts credentials protecting against insider threats and lateral movement by attackers who have already breached the network,Telnet passwords are too short (4 characters max) while SSH enforces longer passwords protecting brute-force attacks,C,Even on a trusted internal network a compromised host or network tap can capture Telnet credentials. SSH encrypts the entire session so a captured packet reveals nothing useful. This is especially important for switch and router management where captured credentials could give an attacker full network control.,why ssh matters,ssh encrypts credentials protecting against internal sniffing and compromised hosts,/home/citadel/Documents/citavault/NETC-121/Notes List A - Video Content/Video 10 - Telnet and SSH/Transcript.md
medium,What determines whether a DTP negotiation between two Cisco switch ports results in a trunk?,The port with the higher bridge priority becomes the trunk initiator; the lower priority port accepts,Trunk formation depends on the VLAN IDs configured on each port; matching VLANs always form a trunk,If either port is in desirable mode or both are in desirable mode a trunk forms; if both are in auto mode no trunk forms because neither side initiates,Trunk formation requires manual confirmation from the administrator regardless of DTP mode,C,DTP outcomes: Auto + Auto = no trunk (neither side sends DTP negotiate). Desirable + Auto = trunk (desirable sends; auto accepts). Desirable + Desirable = trunk (both send; either accepts). Hard-coded trunk on one side: trunk forms if the other side accepts it (auto or desirable).,dtp negotiation outcomes,desirable plus any mode forms trunk; auto plus auto does not because neither initiates,/home/citadel/Documents/citavault/NETC-121/Notes List B - Textbook Content/Textbook 1 - Chapter 3 Switches, Routers, and VLANs/Book 1 Chapter 3 - Switches, Routers, and VLANs.md
medium,How does an unmanaged switch differ from a managed switch and why does VLAN configuration require a managed switch?,Unmanaged switches are Layer 3 devices; managed switches are Layer 2 only; VLANs require Layer 3 processing,Unmanaged switches only support ISL trunking which is incompatible with modern 802.1Q VLANs,Unmanaged switches are plug-and-play devices with no remote configurability; VLANs require port assignment commands that can only be issued on a managed switch with a CLI or web interface,Unmanaged switches use static MAC tables that cannot update dynamically; VLAN configuration requires dynamic MAC learning,C,An unmanaged switch has no configuration interface — it just forwards frames out of the box. Creating VLANs and assigning ports requires issuing configuration commands. This requires a managed switch that has a management interface (CLI via SSH/Telnet; or web GUI) and supports VLAN features.,managed vs unmanaged switch,vlan configuration requires managed switch with configurable cli or web interface,/home/citadel/Documents/citavault/NETC-121/Notes List B - Textbook Content/Textbook 1 - Chapter 3 Switches, Routers, and VLANs/Book 1 Chapter 3 - Switches, Routers, and VLANs.md
medium,What is the operational difference between Cisco's term trunking and other vendors' term tagging?,Trunking refers to LACP link aggregation on Cisco equipment; tagging refers to 802.1Q VLAN marking on non-Cisco equipment,Trunking means carrying multiple VLANs over one link; tagging describes the 802.1Q marking mechanism — different terms for the same concept depending on vendor,Trunking is a Layer 2 concept while tagging is Layer 3; they operate at different OSI layers,Cisco uses trunking for ISL and tagging for 802.1Q; the two terms describe different encapsulation protocols,B,Cisco commonly calls the feature trunk and the port a trunk port. Other vendors (including IEEE documentation) describe the mechanism as tagging — adding a VLAN tag to frames. Both terms describe the same behavior: one physical link carrying traffic for multiple VLANs using frame marking.,trunking vs tagging terminology,trunking (cisco) and tagging (other vendors) describe the same multi-vlan link feature,/home/citadel/Documents/citavault/NETC-121/Notes List A - Video Content/Video 17 - Trunking and 802.1Q/Transcript.md
medium,Why would a network administrator assign the same VLAN to ports on two different physical switches?,So both switches share the same MAC address table and can forward frames without flooding,So a device on SW1 and a device on SW2 can communicate at Layer 2 as if they were on the same switch; requiring a trunk between the switches to carry VLAN-tagged frames between them,So the router can route between the VLAN on SW1 and the VLAN on SW2 using a separate physical link for each switch,VLANs cannot span multiple switches; each switch must have its own unique VLAN ID,B,VLANs can span multiple switches. For VLAN 10 to exist on both SW1 and SW2: the inter-switch link must be a trunk; both switches must have VLAN 10 configured; and devices on VLAN 10 ports of either switch can communicate as one Layer 2 segment.,cross-switch vlan design,same vlan on two switches requires trunk between them to carry vlan-tagged frames,/home/citadel/Documents/citavault/NETC-121/Notes List B - Textbook Content/Textbook 1 - Chapter 3 Switches, Routers, and VLANs/Book 1 Chapter 3 - Switches, Routers, and VLANs.md
medium,What did early Ethernet networks use before switches and why did this create performance and security problems?,Early Ethernet used bridges with four ports; performance was limited by bridge processing speed; security by bridge encryption overhead,Early Ethernet used routers in switching mode; performance suffered because IP routing is slower than MAC forwarding,Early Ethernet used hubs — shared media where all devices competed for bandwidth; collisions degraded performance as networks grew and all devices could see all traffic creating a security risk,Early Ethernet used token-ring topology where one device transmitted at a time; performance suffered from the token wait time,C,Early Ethernet: hub-based shared media. All devices in one collision domain — collisions multiplied with device count. Every device received every frame — passive capture trivial. Switches solved both problems: separate collision domains; and targeted frame delivery.,shared media ethernet,early ethernet used hubs creating shared collision domain and traffic visibility by all,/home/citadel/Documents/citavault/NETC-121/Notes List B - Textbook Content/Textbook 1 - Chapter 3 Switches, Routers, and VLANs/Book 1 Chapter 3 - Switches, Routers, and VLANs.md
medium,A phone is plugged into a switch access port that is also connected to a PC. The port is configured with both an access VLAN for data and a voice VLAN. How does the switch differentiate the traffic?,The switch inspects TCP port numbers to separate voice (UDP/RTP) traffic from data (TCP) traffic at Layer 4,The switch uses the IP DSCP marking to assign traffic to the data or voice VLAN,The IP phone tags its own voice traffic with the voice VLAN ID while the PC sends untagged data traffic; the switch separates them by presence or absence of the 802.1Q tag and its VLAN ID,The switch differentiates traffic by source MAC address since IP phones have a different OUI than PCs,C,Access port with voice VLAN: the IP phone understands 802.1Q and tags its voice frames with the voice VLAN ID. The PC sends untagged traffic. The switch receives both: tagged frames go to the voice VLAN; untagged frames stay in the access (data) VLAN. This allows one physical port to support both simultaneously.,voice vlan and phone behavior,ip phone tags voice traffic; pc sends untagged; switch separates by tag presence,/home/citadel/Documents/citavault/NETC-121/Notes List A - Video Content/Video 17 - Trunking and 802.1Q/Transcript.md
