difficulty,question,choice_a,choice_b,choice_c,choice_d,correct_choice,explanation,concept_key,aspect_key,source_path
medium,What is the Layer 3 limitation of a standard Layer 2 switch and how does this affect VLAN design?,Layer 2 switches cannot process ARP requests so hosts in the same VLAN cannot resolve MAC addresses,Layer 2 switches forward based on MAC addresses and have no visibility into IP addresses; this means they cannot route between VLANs requiring a separate Layer 3 device for inter-VLAN traffic,Layer 2 switches require an IP address per port making large VLAN deployments cost-prohibitive,Layer 2 switches can only support a maximum of 16 VLANs due to their 4-bit VLAN ID field,B,Standard Layer 2 switching is MAC-based and VLAN-aware but IP-blind. For traffic to cross from VLAN 10 to VLAN 20 an IP routing decision must be made by a router or Layer 3 switch. This is why VLAN design always plans for a routing device at the VLAN boundary.,layer 3 visibility limitation,layer 2 switch uses mac not ip so inter-vlan traffic requires a layer 3 device,/home/citadel/Documents/citavault/NETC-121/Notes List B - Textbook Content/Textbook 1 - Chapter 3 Switches, Routers, and VLANs/Book 1 Chapter 3 - Switches, Routers, and VLANs.md
medium,Explain the DTP hardcoded trunk nuance where a manually configured trunk port may still send DTP messages.,A hardcoded trunk port uses DTP desirable mode internally because Cisco IOS treats manual configuration as an active request,A hardcoded trunk port sends DTP messages only if the other side is also in manual trunk mode,Manually configuring a port as trunk with switchport mode trunk may still allow the port to send DTP frames to the connected Cisco device; the full disabling of DTP requires also issuing switchport nonegotiate,Hardcoded trunk ports send DTP messages only to alert the administrator that the port cannot auto-negotiate,C,switchport mode trunk hard-codes the port in trunk mode but on Cisco IOS the port may still generate DTP frames. To completely stop DTP messages the additional command switchport nonegotiate is required. Without this; a connected Cisco device could still try to negotiate trunk parameters.,hardcoded trunk dtp nuance,switchport mode trunk still sends dtp frames; nonegotiate required to fully stop dtp,/home/citadel/Documents/citavault/NETC-121/Notes List B - Textbook Content/Textbook 1 - Chapter 3 Switches, Routers, and VLANs/Book 1 Chapter 3 - Switches, Routers, and VLANs.md
medium,Why does within-VLAN unknown unicast flooding stay within the VLAN and not escape to other VLANs?,Flooding is suppressed on trunk ports to reduce overhead on inter-switch links,The MAC table prevents flooding by always having entries for all ports in any VLAN,VLANs are separate Layer 2 broadcast domains; the switch only floods out ports that are members of the same VLAN as the ingress port,Flooding is blocked at VLAN boundaries by the router so it cannot propagate to other VLANs,C,Flooding respects VLAN membership. When an unknown unicast frame arrives on a VLAN 10 access port the switch floods it out all other VLAN 10 ports (access and trunk ports that carry VLAN 10) — not ports in other VLANs. VLAN isolation is maintained even during flooding.,within-vlan flooding scope,flooding only reaches ports in the same vlan respecting layer 2 vlan isolation,/home/citadel/Documents/citavault/NETC-121/Notes List B - Textbook Content/Textbook 1 - Chapter 3 Switches, Routers, and VLANs/Book 1 Chapter 3 - Switches, Routers, and VLANs.md
medium,What is the relationship between SSH and Telnet in terms of capability and what was the reason for Telnet's original design?,SSH and Telnet provide different functions: Telnet is for file transfer and SSH is for terminal access,SSH is a subset of Telnet that adds encryption; the full Telnet protocol includes SSH as an optional security mode,Both provide remote CLI access; Telnet was designed in 1969 before modern network security was a priority so encryption was not included; SSH was created later specifically to provide the same functionality with encryption,Telnet was deprecated in 1990 and replaced immediately by SSH; no modern devices support Telnet,C,Telnet dates back to 1969 when the internet was small and trusted. Encryption was not considered necessary then. SSH was developed later (1995) to provide the same remote terminal capability — encrypted. Telnet still works but its plaintext design makes it unsuitable for modern network management.,telnet historical context,telnet designed in 1969 before security concerns; ssh added encryption to same capability,/home/citadel/Documents/citavault/NETC-121/Notes List A - Video Content/Video 10 - Telnet and SSH/Transcript.md
medium,What is the effect on the MAC address table when a new device plugs into a port and transmits its first frame?,The MAC table entry for the new device's MAC address is deleted to force flooding until the device is verified,No change occurs because the MAC table is only updated by ARP replies from routers,The switch adds the new device's source MAC address and the port it arrived on as a new entry in the MAC table,The switch broadcasts an ARP probe to confirm the new MAC address is unique before adding it to the table,C,On the very first frame from a new device: the switch reads the source MAC address and the ingress port number and records them in the MAC table. This learning happens on every incoming frame that has a source MAC not currently in the table.,learning result,switch adds source mac and ingress port to mac table on first frame from new device,/home/citadel/Documents/citavault/NETC-121/Notes List B - Textbook Content/Textbook 1 - Chapter 3 Switches, Routers, and VLANs/Book 1 Chapter 3 - Switches, Routers, and VLANs.md
medium,What is the operational security principle behind hard-coding switch port modes?,Hard-coding reduces VLAN database replication traffic letting VTP operate more efficiently,Hard-coding increases the number of VLANs a switch can support by reserving DTP negotiation overhead,Intentional manual port configuration eliminates ambiguity about port roles and reduces the attack surface by preventing unauthorized trunk negotiation,Hard-coding is required because DTP is not supported on access ports and switchport mode must always be set explicitly,C,When port modes are hard-coded an administrator always knows exactly what every port is doing — access or trunk — and why. DTP negotiation is disabled on access ports. This removes a class of attack (unauthorized trunk formation) and makes the network behavior predictable.,operational security principle,hard-coding port modes eliminates ambiguity and prevents unauthorized trunk negotiation,/home/citadel/Documents/citavault/NETC-121/Notes List B - Textbook Content/Textbook 1 - Chapter 3 Switches, Routers, and VLANs/Book 1 Chapter 3 - Switches, Routers, and VLANs.md
medium,Why is it incorrect to say that switching decisions are based on IP addresses for a standard Layer 2 switch?,Switching decisions use MAC addresses for Layer 2 forwarding; IP addresses are used by routers at Layer 3; standard switches do not inspect the IP payload,Switches do inspect IP addresses but only to verify the VLAN assignment matches the IP subnet before forwarding,Switches use IP addresses for unicast forwarding but switch to MAC-based forwarding for broadcast frames,Cisco IOS switches always use IP addresses because Cisco IOS is a Layer 3 operating system regardless of switch model,A,Layer 2 switches make forwarding decisions based on destination MAC address in the Ethernet header. The IP packet is the payload of the Ethernet frame and the switch does not open it for standard forwarding. Only Layer 3 switches or routers use IP addresses to make routing decisions.,layer 2 scope,layer 2 switch uses destination mac not ip for forwarding decisions,/home/citadel/Documents/citavault/NETC-121/Notes List B - Textbook Content/Textbook 1 - Chapter 3 Switches, Routers, and VLANs/Book 1 Chapter 3 - Switches, Routers, and VLANs.md
medium,How does deploying VLANs improve network security compared to a flat switched network?,VLANs encrypt traffic between departments preventing hosts in other VLANs from decoding captured frames,VLANs restrict physical access to switch ports so only authorized personnel can connect devices,VLANs segment the network so a host in one VLAN cannot send or receive Layer 2 traffic destined for another VLAN eliminating a large class of Layer 2 attacks and accidental exposure,VLANs enable per-VLAN ARP inspection which prevents hosts from receiving traffic not addressed to them,C,In a flat network all hosts receive all broadcast traffic and can ARP-spoof or sniff for each other's traffic. VLANs isolate broadcast domains: hosts in different VLANs cannot directly communicate at Layer 2; a router mediates all inter-VLAN traffic providing an inspection point. This reduces the blast radius of a compromised host.,why vlans exist,vlans segment layer 2 so hosts in different vlans cannot directly exchange frames,/home/citadel/Documents/citavault/NETC-121/Notes List A - Video Content/Video 16 - VLANs Made Easy/Transcript.md
medium,An administrator manages a 3-switch network. Each switch has VLANs 10; 20; and 30 configured. They create VLAN 40 on the VTP server. What happens to the other two VTP client switches?,VLAN 40 must be manually created on each client switch because VTP only replicates VLAN deletions,VLAN 40 is automatically added to the VLAN database on both VTP client switches and the administrator must still manually assign access ports to VLAN 40 on each switch,VLAN 40 is automatically added to both client switches including automatic port assignment based on the VLAN name,Nothing happens until the administrator runs copy running-config startup-config on the VTP server to push the update,B,VTP propagates the VLAN database (ID and name) to all clients. Creating VLAN 40 on the server causes both clients to add VLAN 40 to their VLAN table automatically. However VTP does not assign ports — the admin must still manually run switchport access vlan 40 on the relevant ports of each switch.,vtp benefit and limitation,vtp adds vlan 40 to clients automatically but port assignment must still be done manually,/home/citadel/Documents/citavault/NETC-121/Notes List B - Textbook Content/Textbook 1 - Chapter 3 Switches, Routers, and VLANs/Book 1 Chapter 3 - Switches, Routers, and VLANs.md
medium,What is the conceptual difference between the VLAN operating layer and the router's operating layer and why does this matter for traffic between departments?,VLANs and routers both operate at Layer 2; the distinction is only marketing terminology,VLANs operate at Layer 4 for session tracking; routers operate at Layer 2 for frame delivery,VLANs operate at Layer 2 (MAC-based); routers operate at Layer 3 (IP-based); inter-VLAN traffic must be carried from the Layer 2 domain to a router which makes an IP forwarding decision to return it to the correct VLAN,VLANs operate at Layer 3 and can route independently; routers are only needed for internet access,C,VLANs are a Layer 2 construct: they segment MAC-based broadcast domains. Routers are Layer 3: they forward based on IP prefixes. When Host A (VLAN 10; IP 192.168.10.5) needs to reach Host B (VLAN 20; IP 192.168.20.5) the packet leaves Layer 2 domain VLAN 10; is routed by the router's IP forwarding; and enters Layer 2 domain VLAN 20.,vlan operating layer,vlans are layer 2; inter-vlan requires router to make layer 3 ip forwarding decision,/home/citadel/Documents/citavault/NETC-121/Notes List B - Textbook Content/Textbook 1 - Chapter 3 Switches, Routers, and VLANs/Book 1 Chapter 3 - Switches, Routers, and VLANs.md
medium,What is the purpose of the 802.1Q tag requirement for VLAN-aware devices on a trunk?,Any device that does not understand 802.1Q will see the VLAN tag as data corruption and drop the frame; VLAN-aware devices strip the tag for processing,802.1Q tags are only required on router interfaces; switches can forward tagged frames without reading the tag,VLAN-aware devices must add a second tag for ISL encapsulation before forwarding 802.1Q frames,802.1Q tags force all devices on the trunk to operate at the same speed,A,The 802.1Q tag is non-standard to older devices. A device that does not know about VLAN tagging may misinterpret the tag bytes as part of the frame payload or reject the frame as malformed. Trunk links must connect VLAN-aware devices that understand how to insert; read; and strip 802.1Q tags correctly.,need for vlan-aware devices,non-vlan-aware devices cannot process 802.1q tags and will misinterpret or drop tagged frames,/home/citadel/Documents/citavault/NETC-121/Notes List A - Video Content/Video 17 - Trunking and 802.1Q/Transcript.md
medium,How does the subnet connectivity role of a router differ from the VLAN-segmentation role of a switch?,Routers create VLANs; switches route between them,Routers assign MAC addresses to each subnet; switches assign IP addresses to each VLAN,A switch creates logical Layer 2 separation between VLANs; a router connects those separate IP subnets enabling traffic to flow between them at Layer 3,Routers and switches perform identical functions — the distinction is only the number of ports,C,Switch role: create VLANs as separate Layer 2 broadcast domains. Router role: connect those VLANs' IP subnets together at Layer 3. Each device has a complementary role in a properly segmented network — switches segment; routers connect.,subnet connectivity role,switch segments vlans at layer 2; router connects their ip subnets at layer 3,/home/citadel/Documents/citavault/NETC-121/Notes List B - Textbook Content/Textbook 1 - Chapter 3 Switches, Routers, and VLANs/Book 1 Chapter 3 - Switches, Routers, and VLANs.md
medium,When is Ethernet considered to have overcome legacy networking systems like ARCNET and Token Ring?,In the 1960s when the ARPANET adopted Ethernet as its standard link-layer protocol,Token Ring and ARCNET are still in use today in industrial networks and have not been fully replaced,Ethernet was invented in the late 1970s; became commercially available in 1980; and eventually displaced competing systems like ARCNET and Token Ring due to its scalability and cost advantages,Token Ring defeated Ethernet in enterprise networks until 802.11 Wi-Fi made both obsolete simultaneously,C,Ethernet was invented at Xerox PARC in the late 1970s and commercialized in 1980. Over the following years it outcompeted alternatives like ARCNET and Token Ring because it scaled better and became cheaper. It is now the dominant wired LAN standard.,ethernet historical note,ethernet invented 1970s commercialized 1980 eventually replaced arcnet and token ring,/home/citadel/Documents/citavault/NETC-121/Notes List B - Textbook Content/Textbook 1 - Chapter 3 Switches, Routers, and VLANs/Book 1 Chapter 3 - Switches, Routers, and VLANs.md
medium,On a shared Ethernet segment a host receives a frame. Its destination MAC does not match the host's own MAC. What does the host do in normal operation vs. promiscuous mode?,Normal operation: the host processes the frame and replies; promiscuous mode: the host drops the frame silently,Normal operation and promiscuous mode behave identically for non-matching frames,Normal operation: the host discards the frame; promiscuous mode: the host passes the frame to the OS for capture and analysis,Normal operation: the host sends an ICMP reject; promiscuous mode: the host forwards the frame to the next device,C,Ethernet packet screening: in normal operation a host checks the destination MAC; if it does not match the host's own MAC or the broadcast address the frame is discarded at the NIC level. In promiscuous mode (used by Wireshark and similar tools) the NIC passes all frames to the OS regardless of destination MAC — enabling passive traffic capture.,ethernet packet screening behavior,normal mode discards non-matching frames; promiscuous mode captures all frames,/home/citadel/Documents/citavault/NETC-121/Notes List B - Textbook Content/Textbook 1 - Chapter 3 Switches, Routers, and VLANs/Book 1 Chapter 3 - Switches, Routers, and VLANs.md
medium,What is the VPN tunnel concept and why is it called a tunnel?,VPN tunnels are called tunnels because they traverse underground fiber optic cable infrastructure,VPN tunnel refers to the logical path through a router's internal routing table from source to destination subnet,A VPN is called a tunnel because the encrypted connection creates an isolated protected path through the public internet; from an outsider's view traffic appears as opaque encrypted data traversing the public network,VPN tunnels are called tunnels because they encapsulate IPv4 packets inside IPv6 for compatibility across dual-stack networks,C,A VPN tunnel encapsulates encrypted data inside packets that cross the public internet. The contents are opaque to anyone along the path — only the endpoints can decrypt them. The analogy to a physical tunnel: the path passes through shared space but the contents are isolated and protected from the surrounding environment.,vpn tunnel concept,vpn tunnel creates encrypted isolated path through the public internet,/home/citadel/Documents/citavault/NETC-121/Notes List B - Textbook Content/Textbook 1 - Chapter 3 Switches, Routers, and VLANs/Book 1 Chapter 3 - Switches, Routers, and VLANs.md
medium,A switch port connects to a second switch rather than a single host. What are the implications for the MAC address table and forwarding?,The switch can only store one MAC per port so traffic from the downstream switch will be dropped after the first host is learned,The switch stores multiple MAC addresses on the port that leads to the downstream switch one for each host reachable through it,The switch disables learning on uplink ports and always floods inter-switch frames,The switch creates a separate MAC table for each switch in the network to avoid MAC address conflicts,B,A switch port leading to another switch will have multiple MAC addresses associated with it — one for each host that is reachable through that link. The switch records all of them as learned on the upstream port. This is how MAC tables scale to multi-switch networks.,multiple macs on one port,switch learns multiple mac addresses on an uplink port one per reachable downstream host,/home/citadel/Documents/citavault/NETC-121/Notes List B - Textbook Content/Textbook 1 - Chapter 3 Switches, Routers, and VLANs/Book 1 Chapter 3 - Switches, Routers, and VLANs.md
medium,What is the administrative advantage of manually creating VLANs and assigning ports rather than relying on automatic or dynamic VLAN assignment?,Automatic VLAN assignment is more accurate than manual assignment because it uses the device MAC database,Manual creation gives administrators explicit control over which devices belong to which broadcast domain preventing accidental or unauthorized VLAN membership,Manual VLAN assignment is required because dynamic assignment is not supported on any managed switch,Automatic VLAN assignment requires a VTP server which is a single point of failure; manual assignment avoids this dependency,B,VLAN membership determines what a device can and cannot reach at Layer 2. Explicit manual assignment ensures the administrator intentionally controls this access. Misassignment means a device might land in the wrong broadcast domain accessing resources it should not. Manual control is part of the security discipline of VLAN design.,manual vlan administration,manual vlan and port assignment gives explicit control over broadcast domain membership,/home/citadel/Documents/citavault/NETC-121/Notes List B - Textbook Content/Textbook 1 - Chapter 3 Switches, Routers, and VLANs/Book 1 Chapter 3 - Switches, Routers, and VLANs.md
medium,How does a switch bridge two different link speeds such as a 1 Gbps host port and a 100 Mbps printer port?,The switch reduces the host port speed to 100 Mbps to match the printer and prevents loss,The switch requires both ports to run at the same speed and will not forward frames if speeds differ,The switch buffers incoming frames in memory adapting to the speed difference so both devices can operate at their native rates and frames are not dropped due to the speed gap,The switch sends the frame at 1 Gbps to the 100 Mbps printer and the printer buffers the excess,C,Switch buffers allow speed adaptation. A 1 Gbps frame arriving for a 100 Mbps destination port is stored in the switch's buffer. The switch then transmits it out the 100 Mbps port at that port's native rate. This is one of the fundamental functions of switch buffering — absorbing speed mismatches between ports.,bridge speed adaptation role,switch buffers frames to adapt between different link speeds on ingress and egress ports,/home/citadel/Documents/citavault/NETC-121/Notes List B - Textbook Content/Textbook 1 - Chapter 3 Switches, Routers, and VLANs/Book 1 Chapter 3 - Switches, Routers, and VLANs.md
medium,What happens to a Telnet session when an attacker runs a packet capture tool on the same network segment?,The attacker can capture the TCP segments but cannot read the content because Telnet compresses its payload,The attacker captures only the packet headers; the Telnet session body is encrypted by the OS TCP stack,The attacker must send a MITM redirect first; a passive capture cannot read Telnet because the session uses challenge-response authentication,The attacker captures the packets and can read all usernames; passwords; commands; and output in plaintext from the captured data,D,Telnet sends everything in cleartext. A network capture tool (Wireshark; tcpdump) on the same segment captures all Telnet packets and the payload — which is the entire terminal session — is human-readable. No decryption needed. This is the fundamental reason Telnet is inappropriate for managing network infrastructure.,why plaintext is dangerous,telnet session is fully readable in packet captures including all credentials and commands,/home/citadel/Documents/citavault/NETC-121/Notes List A - Video Content/Video 10 - Telnet and SSH/Transcript.md
medium,What is the conceptual relationship between the switch VLAN database and the trunk link in enabling the same VLAN to span two switches?,The VLAN database on each switch independently assigns IP addresses that the trunk link uses to route between VLANs,The trunk link carries all VLAN traffic as untagged frames and the receiving switch reassigns the VLAN based on its local port mapping,Both switches must have the VLAN ID in their VLAN database; the 802.1Q trunk link carries tagged frames preserving the VLAN ID so the receiving switch delivers frames to the correct VLAN ports,The VLAN database is only needed on the VTP server; the trunk link propagates VLAN membership to client switch ports automatically,C,For VLAN 10 to span two switches: (1) VLAN 10 must exist in both switches' VLAN databases (via VTP or manual config); (2) the inter-switch link must be a trunk; (3) the trunk must allow VLAN 10; (4) the trunk uses 802.1Q tags to identify which frames belong to VLAN 10. Without all three elements the VLAN cannot span both switches.,cross-switch vlan design,vlan must exist in both databases and trunk must carry tagged frames for vlan to span switches,/home/citadel/Documents/citavault/NETC-121/Notes List A - Video Content/Video 17 - Trunking and 802.1Q/Transcript.md
hard,A switch has three ports in VLAN 10 (ports 1-3) and two ports in VLAN 20 (ports 4-5). A broadcast arrives on port 1. Which ports receive the frame and why do ports 4 and 5 not receive it?,Ports 2; 3; 4; and 5 receive the broadcast because broadcasts always reach all switch ports,Only port 1 receives a copy because the switch mirrors broadcasts to the source port,Ports 2 and 3 receive the broadcast because VLANs are separate Layer 2 broadcast domains and the switch only floods within VLAN 10,Ports 2; 3; and 4 receive the broadcast; port 5 is excluded as it is furthest from port 1,C,Broadcast flooding respects VLAN membership. The frame arrives in VLAN 10 (port 1). The switch floods it out all other VLAN 10 ports (ports 2 and 3). Ports 4 and 5 are in VLAN 20 — a separate broadcast domain. They do not participate in VLAN 10 broadcasts. VLAN segmentation is the mechanism that stops cross-VLAN flooding.,broadcast-domain reduction,vlan 10 broadcast floods only to vlan 10 ports; vlan 20 ports are a separate domain,/home/citadel/Documents/citavault/NETC-121/Notes List A - Video Content/Video 16 - VLANs Made Easy/Transcript.md
