difficulty,question,choice_a,choice_b,choice_c,choice_d,correct_choice,explanation,concept_key,aspect_key,source_path
easy,What is a hub?,A Layer 2 device that forwards frames based on destination MAC addresses,A Layer 3 device that routes traffic between different IP subnets,A Layer 1 device that repeats incoming electrical signals out all other ports,A device that manages VLAN assignments across multiple switches,C,A hub is a Layer 1 device. It simply repeats an incoming electrical signal out every other port without inspecting frame contents or caring about the intended destination.,hub definition,hub repeats signals out all ports without inspecting frame contents,/home/citadel/Documents/citavault/NETC-121/Notes List B - Textbook Content/Textbook 1 - Chapter 3 Switches, Routers, and VLANs/Book 1 Chapter 3 - Switches, Routers, and VLANs.md
easy,What is the primary job of a switch?,To repeat electrical signals out all ports to maximize coverage,To translate IP addresses into MAC addresses for local delivery,To encrypt traffic between VLANs for security,To inspect Ethernet headers and forward frames based on destination MAC addresses,D,A switch is a Layer 2 device. It reads the destination MAC address in an Ethernet frame and forwards the frame only to the port associated with that MAC address.,switch definition,switch inspects ethernet headers and forwards based on mac address,/home/citadel/Documents/citavault/NETC-121/Notes List B - Textbook Content/Textbook 1 - Chapter 3 Switches, Routers, and VLANs/Book 1 Chapter 3 - Switches, Routers, and VLANs.md
easy,How long is a MAC address?,16 bits,32 bits,128 bits,48 bits,D,A MAC address is 48 bits long; typically written as six octets separated by hyphens (e.g. 21-76-3D-7A-F6-1E). Each octet is 8 bits so six octets = 48 bits total.,mac address,mac address is 48 bits written as six hyphen-separated octets,/home/citadel/Documents/citavault/NETC-121/Notes List B - Textbook Content/Textbook 1 - Chapter 3 Switches, Routers, and VLANs/Book 1 Chapter 3 - Switches, Routers, and VLANs.md
easy,How does a switch learn which port a device is connected to?,It queries a central DHCP server that maps MAC addresses to switch ports,It reads the source MAC address on incoming frames and associates it with the port the frame arrived on,It broadcasts a discovery packet and waits for devices to reply with their port numbers,It uses ARP to resolve IP addresses to MAC addresses and stores the result in its routing table,B,The learning process: when a frame arrives the switch reads the source MAC address and records it along with the ingress port in the MAC address table. Future frames destined for that MAC are forwarded directly to the learned port.,switch learning,switch learns source mac and ingress port from each incoming frame,/home/citadel/Documents/citavault/NETC-121/Notes List B - Textbook Content/Textbook 1 - Chapter 3 Switches, Routers, and VLANs/Book 1 Chapter 3 - Switches, Routers, and VLANs.md
easy,What does a switch do when the destination MAC address is not in its MAC address table?,It drops the frame and sends an ICMP unreachable message to the sender,It forwards the frame to the default gateway for resolution,It sends the frame only to the port configured as the uplink,It floods the frame out all ports except the port the frame arrived on,D,Flooding is the fallback behavior when the switch has no learned entry for the destination MAC. The switch sends the frame to all ports except the ingress port so the unknown destination has a chance to receive and respond.,flooding definition,unknown destination mac causes switch to flood out all ports except ingress,/home/citadel/Documents/citavault/NETC-121/Notes List B - Textbook Content/Textbook 1 - Chapter 3 Switches, Routers, and VLANs/Book 1 Chapter 3 - Switches, Routers, and VLANs.md
easy,What is a VLAN?,A physical cable standard for separating department networks at the wiring closet,A Layer 3 routing protocol for connecting remote offices over the internet,A logical Layer 2 network built on shared physical switch infrastructure that separates traffic without physical rewiring,A wireless segmentation method for isolating Wi-Fi traffic from wired traffic,C,A VLAN (Virtual Local Area Network) is a logical grouping of switch ports that creates a separate Layer 2 broadcast domain. Devices in different VLANs are isolated at Layer 2 even though they share the same physical switch.,vlan definition,vlan is a logical layer 2 network on shared physical switch infrastructure,/home/citadel/Documents/citavault/NETC-121/Notes List A - Video Content/Video 16 - VLANs Made Easy/Transcript.md
easy,What is an access port?,A port that carries traffic for multiple VLANs using 802.1Q tagging,A port that connects a switch to a router for inter-VLAN routing,A high-speed uplink port used for inter-switch connections,A port that carries traffic for only one VLAN and sends frames without a VLAN tag,D,An access port connects an endpoint device and carries traffic for exactly one VLAN. Frames leaving an access port are untagged — the endpoint device receives a normal Ethernet frame with no VLAN identifier.,access port definition,access port carries one vlan and delivers untagged frames to endpoints,/home/citadel/Documents/citavault/NETC-121/Notes List B - Textbook Content/Textbook 1 - Chapter 3 Switches, Routers, and VLANs/Book 1 Chapter 3 - Switches, Routers, and VLANs.md
easy,What is a collision domain?,The set of devices that receive a Layer 2 broadcast frame,The IP subnet range shared by devices on the same network segment,The group of switch ports that share the same VLAN assignment,The segment of a network where simultaneous transmissions collide and corrupt each other,D,A collision domain is any network segment where two devices transmitting at the same time produce a collision. Hubs keep all ports in one large collision domain. Switches break each port link into its own collision domain.,collision domain,collision domain is where simultaneous transmissions cause collisions,/home/citadel/Documents/citavault/NETC-121/Notes List B - Textbook Content/Textbook 1 - Chapter 3 Switches, Routers, and VLANs/Book 1 Chapter 3 - Switches, Routers, and VLANs.md
easy,What is a broadcast domain?,The area of the network where 802.1Q trunk links carry multiple VLANs simultaneously,The set of switch ports that share the same collision detection mechanism,The segment of a network where a Layer 2 broadcast frame is received by all devices,The range of IP addresses assigned by a DHCP server to hosts on a subnet,C,A broadcast domain is the set of devices that all receive a broadcast frame (destination MAC FF-FF-FF-FF-FF-FF). Switches forward broadcasts to all ports in the same VLAN; routers and VLANs segment broadcast domains.,broadcast domain definition,broadcast domain is where all devices receive a layer 2 broadcast frame,/home/citadel/Documents/citavault/NETC-121/Notes List B - Textbook Content/Textbook 1 - Chapter 3 Switches, Routers, and VLANs/Book 1 Chapter 3 - Switches, Routers, and VLANs.md
easy,What does VTP stand for and what is its purpose?,Virtual Trunk Protocol — the actual tagging standard for VLAN frames on trunk links,VLAN Transfer Protocol — a Cisco protocol for migrating VLAN configs between switches of different vendors,VLAN Trunking Protocol — a Cisco protocol that replicates VLAN information between Cisco switches over trunk links,Virtual Tagging Protocol — the IEEE standard for attaching VLAN IDs to Ethernet frames,C,VTP (VLAN Trunking Protocol) is Cisco proprietary. It is not the mechanism that tags frames; 802.1Q does that. VTP replicates VLAN database information (VLAN IDs and names) between Cisco switches so they do not all need to be configured manually.,vtp,vtp replicates vlan information between cisco switches over trunk links,/home/citadel/Documents/citavault/NETC-121/Notes List B - Textbook Content/Textbook 1 - Chapter 3 Switches, Routers, and VLANs/Book 1 Chapter 3 - Switches, Routers, and VLANs.md
easy,What is trunking in a switched network?,A method of encrypting traffic between two switches to prevent eavesdropping,Allowing traffic for multiple VLANs to travel across one physical link using VLAN tagging,A redundancy protocol that prevents loops on inter-switch links,The process of aggregating multiple physical links into one logical link for increased bandwidth,B,Trunking lets one physical link carry traffic for multiple VLANs simultaneously. Each frame is tagged (802.1Q) so the receiving device knows which VLAN it belongs to. Without trunking VLANs could not extend across multiple switches.,trunking definition,trunking carries multiple vlans over one physical link using vlan tags,/home/citadel/Documents/citavault/NETC-121/Notes List A - Video Content/Video 17 - Trunking and 802.1Q/Transcript.md
easy,What IEEE standard defines VLAN tagging on trunk links?,802.3af,802.1D,802.11,802.1Q,D,IEEE 802.1Q is the industry-standard method for tagging VLAN traffic on trunk links. It inserts a 4-byte tag into the Ethernet frame identifying the VLAN. All VLAN-aware devices on the trunk must understand 802.1Q to process tagged frames.,802.1q standard,802.1q is the ieee standard for vlan tagging on trunk links,/home/citadel/Documents/citavault/NETC-121/Notes List A - Video Content/Video 17 - Trunking and 802.1Q/Transcript.md
easy,What is SSH and why is it used for network device management?,SSH is a file sharing protocol used to move configuration files between network devices,SSH is a Layer 2 protocol for encrypting VLAN traffic on trunk links,SSH is a secure remote terminal protocol that encrypts credentials and commands; used to manage routers and switches over the network,SSH is a monitoring protocol that collects interface statistics from managed switches,C,SSH (Secure Shell) provides encrypted remote CLI access to network devices. It replaces Telnet which sends all data — including passwords — in cleartext. SSH encrypts the entire session protecting credentials from eavesdropping.,ssh definition,ssh is an encrypted remote terminal protocol for managing network devices,/home/citadel/Documents/citavault/NETC-121/Notes List A - Video Content/Video 10 - Telnet and SSH/Transcript.md
easy,What is a router's primary function?,To repeat electrical signals to extend the reach of an Ethernet segment,To learn MAC addresses and forward frames within a Layer 2 network,To forward traffic based on IP addresses connecting different IP networks or subnets,To assign VLAN IDs to ports on a managed switch,C,A router is a Layer 3 device. It examines destination IP addresses in packets and forwards them toward the correct subnet. Routers connect separate IP networks — and are required to connect a LAN to the internet.,router definition,router forwards traffic based on ip addresses between different subnets,/home/citadel/Documents/citavault/NETC-121/Notes List B - Textbook Content/Textbook 1 - Chapter 3 Switches, Routers, and VLANs/Book 1 Chapter 3 - Switches, Routers, and VLANs.md
easy,What is NAT?,A protocol that converts MAC addresses to IP addresses for Layer 3 routing,A method that lets multiple private devices share one public IP address at the router,A VLAN tagging mechanism used by routers to separate broadcast domains,A routing protocol used to exchange subnet information between routers,B,NAT (Network Address Translation) allows many private IP hosts to share one public IP. The router substitutes its public IP as the source when internal hosts reach the internet and tracks sessions to return replies to the correct internal host.,nat definition,nat lets multiple private devices share one public ip at the router,/home/citadel/Documents/citavault/NETC-121/Notes List B - Textbook Content/Textbook 1 - Chapter 3 Switches, Routers, and VLANs/Book 1 Chapter 3 - Switches, Routers, and VLANs.md
easy,What is DTP?,Dynamic Trunking Protocol — a Cisco protocol that negotiates whether a switch link should become a trunk,Dynamic Transfer Protocol — the mechanism that moves VLAN databases between switches,Designated Trunk Protocol — the IEEE standard that replaced ISL for VLAN tagging,Direct Trunk Path — the physical uplink between a distribution switch and a core switch,A,DTP (Dynamic Trunking Protocol) is Cisco proprietary. It negotiates trunk formation between Cisco switch ports. DTP auto mode waits passively; DTP desirable mode actively tries to form a trunk. Hard-coding port modes is preferred over relying on DTP.,dtp,dtp negotiates trunk formation between cisco switch ports,/home/citadel/Documents/citavault/NETC-121/Notes List B - Textbook Content/Textbook 1 - Chapter 3 Switches, Routers, and VLANs/Book 1 Chapter 3 - Switches, Routers, and VLANs.md
easy,What is a trunk port?,A port reserved for management traffic and switch configuration,A port that connects only PoE-powered devices like IP phones and cameras,A port that carries traffic for only one VLAN and delivers frames untagged,A port that carries traffic for more than one VLAN using 802.1Q tagging,D,A trunk port carries multiple VLANs over one physical link. Each frame is tagged with an 802.1Q VLAN ID. Trunk ports commonly connect switches to other switches; to routers; or to VLAN-aware servers.,trunk port definition,trunk port carries multiple vlans using 802.1q tagging,/home/citadel/Documents/citavault/NETC-121/Notes List A - Video Content/Video 17 - Trunking and 802.1Q/Transcript.md
easy,What is a VPN?,A VLAN protocol that uses encryption to protect inter-VLAN traffic on trunk links,An encrypted connection built across a public network like the internet to create a secure private path,A protocol for dynamically assigning IP addresses to remote access devices,A Cisco proprietary trunking method replaced by 802.1Q,B,A VPN (Virtual Private Network) is an encrypted tunnel built over the internet. Common use cases are giving remote workers secure access to the company network (remote-access VPN) and connecting offices in different cities (site-to-site VPN).,vpn definition,vpn is an encrypted connection over a public network creating a secure private path,/home/citadel/Documents/citavault/NETC-121/Notes List B - Textbook Content/Textbook 1 - Chapter 3 Switches, Routers, and VLANs/Book 1 Chapter 3 - Switches, Routers, and VLANs.md
easy,What does a switch do with a frame that has destination MAC FF-FF-FF-FF-FF-FF?,It drops the frame because FF-FF-FF-FF-FF-FF is not a valid unicast destination,It forwards the frame only to the port listed in the MAC address table for that address,It sends the frame to the default gateway for routing,It forwards the frame to all ports except the ingress port as a broadcast,D,FF-FF-FF-FF-FF-FF is the Layer 2 broadcast address. When a switch receives a frame with this destination it forwards a copy out every port in the same VLAN except the port the frame came in on. All devices in the broadcast domain receive it.,broadcast frame behavior,ff-ff-ff-ff-ff-ff destination causes switch to broadcast to all ports,/home/citadel/Documents/citavault/NETC-121/Notes List B - Textbook Content/Textbook 1 - Chapter 3 Switches, Routers, and VLANs/Book 1 Chapter 3 - Switches, Routers, and VLANs.md
easy,What is the MAC address table also called?,The IP routing table,The ARP cache,The forwarding database,The VLAN assignment table,C,The MAC address table — which maps learned MAC addresses to switch ports — is also called the forwarding database. Both terms refer to the same data structure the switch uses to make frame forwarding decisions.,mac address table,mac address table is also called the forwarding database,/home/citadel/Documents/citavault/NETC-121/Notes List B - Textbook Content/Textbook 1 - Chapter 3 Switches, Routers, and VLANs/Book 1 Chapter 3 - Switches, Routers, and VLANs.md
easy,What does Telnet send over the network?,Only usernames in plaintext while passwords are encrypted with a one-way hash,Usernames; passwords; commands; and all output in plaintext with no encryption,Encrypted command output but plaintext usernames to identify the user,Only configuration data encrypted; interactive session traffic is excluded,B,Telnet is a legacy protocol that transmits all session data — including usernames; passwords; and every command typed — in plaintext. Anyone monitoring the network path can capture and read the credentials directly.,telnet weakness,telnet sends all credentials and commands in plaintext with no encryption,/home/citadel/Documents/citavault/NETC-121/Notes List A - Video Content/Video 10 - Telnet and SSH/Transcript.md
easy,What is a managed switch?,A switch that forwards frames only at Layer 1 using signal amplification,A switch with a fixed configuration that cannot be changed after manufacture,A high-speed core switch designed only for inter-switch uplink connections,A switch that can be configured and monitored remotely often via a web interface or CLI,D,A managed switch supports remote configuration and monitoring. It typically has an IP address for management access; supports VLAN configuration; and may offer a web interface or CLI (via Telnet or SSH). VLAN deployment requires managed switches.,managed switch definition,managed switch supports remote configuration and monitoring,/home/citadel/Documents/citavault/NETC-121/Notes List B - Textbook Content/Textbook 1 - Chapter 3 Switches, Routers, and VLANs/Book 1 Chapter 3 - Switches, Routers, and VLANs.md
easy,What happens to the collision domain when a hub is replaced with a switch?,The switch merges all device collision domains into a single shared segment,The collision domain is unchanged because switches still share physical media,Each switch port becomes its own separate collision domain eliminating most collision risk,The switch eliminates all broadcast domains in addition to collision domains,C,Hubs put all connected devices into one large collision domain. A switch creates a separate collision domain per port link. This means two devices communicating through a switch do not interfere with other pairs communicating on other ports simultaneously.,switch collision domain behavior,switch creates separate collision domain per port eliminating shared collisions,/home/citadel/Documents/citavault/NETC-121/Notes List B - Textbook Content/Textbook 1 - Chapter 3 Switches, Routers, and VLANs/Book 1 Chapter 3 - Switches, Routers, and VLANs.md
easy,What Layer of the OSI model does a router operate at?,Layer 1 — physical,Layer 2 — data link,Layer 4 — transport,Layer 3 — network,D,Routers operate at Layer 3 (network layer) of the OSI model. They make forwarding decisions based on IP addresses. Switches primarily operate at Layer 2 (data link) using MAC addresses.,router layer,router operates at layer 3 network layer using ip addresses,/home/citadel/Documents/citavault/NETC-121/Notes List B - Textbook Content/Textbook 1 - Chapter 3 Switches, Routers, and VLANs/Book 1 Chapter 3 - Switches, Routers, and VLANs.md
easy,Why is traffic between two VLANs on the same switch not forwarded at Layer 2?,Switches always drop traffic between VLANs to protect the MAC address table from being overwritten,VLANs operate at Layer 3 so they require NAT translation before forwarding between segments,Each VLAN is a separate Layer 2 broadcast domain and a switch only forwards frames within the same VLAN; a Layer 3 device is needed to route between VLANs,Traffic between VLANs is denied by DTP until an administrator manually authorizes the path,C,VLANs create separate Layer 2 broadcast domains. A Layer 2 switch only forwards frames within the same VLAN. To move traffic from VLAN 10 to VLAN 20; a Layer 3 device (router or Layer 3 switch) must route the packet between subnets.,inter-vlan routing requirement,layer 2 switch cannot forward between vlans; a layer 3 device is required,/home/citadel/Documents/citavault/NETC-121/Notes List B - Textbook Content/Textbook 1 - Chapter 3 Switches, Routers, and VLANs/Book 1 Chapter 3 - Switches, Routers, and VLANs.md
easy,What is a bridge?,A Layer 2 device similar to a switch but typically with only two ports used to connect network segments,A Layer 3 device that filters traffic by IP address between VLANs,A physical cable connector used to join two fiber optic runs,A software-only construct used to create virtual network interfaces inside a hypervisor,A,A bridge is a MAC-forwarding device like a switch but usually has only two ports. Bridges predate inexpensive multiport switches. A modern switch is essentially a multiport bridge. Bridges can also join different media types or speeds.,bridge definition,bridge is a mac-forwarding two-port device predecessor to modern switches,/home/citadel/Documents/citavault/NETC-121/Notes List B - Textbook Content/Textbook 1 - Chapter 3 Switches, Routers, and VLANs/Book 1 Chapter 3 - Switches, Routers, and VLANs.md
easy,What is an SFP port?,A software-defined port used to assign VLAN IDs on managed switches,A modular high-speed interface port that accepts pluggable copper or fiber transceiver modules,A dedicated management port used only for out-of-band switch administration,A special port that supplies PoE power to connected devices,B,SFP (Small Form-Factor Pluggable) ports accept modular transceivers for different media types. You can insert an SFP module for 10 Gbps copper or 8 Gbps fiber depending on what the link requires. This gives the switch flexible high-speed connectivity options.,sfp definition,sfp is a modular pluggable interface port accepting copper or fiber transceivers,/home/citadel/Documents/citavault/NETC-121/Notes List B - Textbook Content/Textbook 1 - Chapter 3 Switches, Routers, and VLANs/Book 1 Chapter 3 - Switches, Routers, and VLANs.md
easy,What does router-on-a-stick mean?,A router connected serially to a hub using a shared coaxial backbone cable,A router that uses one physical interface with multiple subinterfaces over an 802.1Q trunk to route between VLANs,A router that handles both NAT and VPN on the same physical device simultaneously,A router with a single IP address shared across all VLANs for simplified management,B,Router-on-a-stick: one physical router port is trunked to the switch. The router creates subinterfaces (e.g. fa0/0.10 for VLAN 10; fa0/0.20 for VLAN 20) each with encapsulation dot1Q and a gateway IP. All inter-VLAN traffic routes through that one physical link.,router-on-a-stick definition,router-on-a-stick uses one trunk interface with subinterfaces to route between vlans,/home/citadel/Documents/citavault/NETC-121/Notes List A - Video Content/Video 17 - Trunking and 802.1Q/Transcript.md
easy,What problem does ARP use broadcasts to solve?,ARP broadcasts ask routers which path to use to reach a remote subnet,ARP broadcasts notify all hosts that a new device has joined the VLAN,ARP broadcasts ask all devices on the local segment which MAC address corresponds to a given IP address,ARP broadcasts advertise the default gateway IP to newly connected hosts,C,ARP (Address Resolution Protocol) resolves IP addresses to MAC addresses. When a host needs to send a frame to an IP address it does not have a MAC for; it broadcasts an ARP request to ask all local devices which one owns that IP. ARP is a common source of broadcast traffic.,arp broadcast behavior,arp broadcasts ask who owns a given ip address to get the corresponding mac,/home/citadel/Documents/citavault/NETC-121/Notes List B - Textbook Content/Textbook 1 - Chapter 3 Switches, Routers, and VLANs/Book 1 Chapter 3 - Switches, Routers, and VLANs.md
easy,What is the default VLAN that all switch ports belong to before any VLAN configuration is applied?,VLAN 0,VLAN 99,VLAN 4094,VLAN 1,D,On most switches all ports default to VLAN 1 out of the box. This means all devices connected to an unconfigured switch can communicate with each other. Administrators must explicitly assign ports to other VLANs to create logical separation.,vlan1 default,all switch ports default to vlan 1 before any vlan configuration,/home/citadel/Documents/citavault/NETC-121/Notes List B - Textbook Content/Textbook 1 - Chapter 3 Switches, Routers, and VLANs/Book 1 Chapter 3 - Switches, Routers, and VLANs.md
easy,What is an uplink port on a switch?,A port that provides PoE power to connected IP phones and cameras,A port that connects a switch to another switch carrying aggregated traffic from many downstream hosts,A port that connects directly to end-user workstations and printers,A port that provides console access for out-of-band management,B,An uplink is an inter-switch connection. Uplink ports carry aggregated traffic from all downstream hosts and are typically configured at higher speeds because they handle more traffic than ordinary access ports.,uplink definition,uplink is an inter-switch port carrying aggregated downstream traffic,/home/citadel/Documents/citavault/NETC-121/Notes List B - Textbook Content/Textbook 1 - Chapter 3 Switches, Routers, and VLANs/Book 1 Chapter 3 - Switches, Routers, and VLANs.md
easy,What is the security risk of leaving switch ports in DTP auto mode?,Auto mode increases BPDU traffic causing STP to re-elect the root bridge more frequently,Auto mode prevents VLAN tagging on the port making all traffic unreadable by other switches,Auto mode enables attackers to negotiate a trunk connection gaining access to traffic for all VLANs,Auto mode disables the port-security feature allowing any MAC address to connect,C,DTP auto mode waits passively for a trunk negotiation request. An unauthorized device that speaks DTP can trigger trunk formation allowing it to send and receive tagged traffic for all VLANs — a VLAN hopping risk. Hard-coding access mode prevents this.,dtp security risk,auto mode allows unauthorized device to negotiate trunk and access all vlans,/home/citadel/Documents/citavault/NETC-121/Notes List B - Textbook Content/Textbook 1 - Chapter 3 Switches, Routers, and VLANs/Book 1 Chapter 3 - Switches, Routers, and VLANs.md
