difficulty,question,choice_a,choice_b,choice_c,choice_d,correct_choice,explanation,concept_key,aspect_key,source_path
hard,SW1 has one trunk link to SW2. Both switches have VLANs 10; 20; and 30. A packet enters SW1 on a VLAN 10 access port and needs to reach a host in VLAN 20 on SW2. What path does it take and what devices participate?,The packet crosses the SW1-SW2 trunk tagged as VLAN 10; SW2 strips the tag and forwards it to the VLAN 20 port,The packet crosses the trunk; SW2 performs inter-VLAN routing and delivers it to VLAN 20 without a router,The packet stays in VLAN 10 and the destination host's VLAN 20 assignment is temporarily changed to allow the delivery,The packet leaves SW1 to a router (via VLAN 10); the router routes it to VLAN 20; the router sends it back to SW2 via a VLAN 20 link; SW2 delivers it to the destination host on a VLAN 20 access port,D,Layer 2 cannot cross VLAN boundaries. The packet: (1) exits SW1 on VLAN 10 toward the default gateway router; (2) router strips L2; inspects IP destination; routes to VLAN 20 subnet; (3) router sends frame tagged or over VLAN 20 link to SW2; (4) SW2 delivers to the VLAN 20 access port. A router is mandatory in the path.,inter-vlan routing requirement,inter-vlan cross-switch traffic requires a router; switches alone cannot route between vlans,/home/citadel/Documents/citavault/NETC-121/Notes List B - Textbook Content/Textbook 1 - Chapter 3 Switches, Routers, and VLANs/Book 1 Chapter 3 - Switches, Routers, and VLANs.md
hard,An administrator notices that after a network move a switch port connecting to a downstream switch has hundreds of MAC addresses in the MAC table but the previous port only had a few. What does this indicate and is it a problem?,Hundreds of MAC addresses on one port indicates a broadcast storm and must be remediated immediately by disabling the port,Multiple MAC addresses on one uplink port is normal — each reflects one host reachable through the downstream switch; the count growing with more downstream hosts is expected behavior,Multiple MAC addresses on one port is a sign of a MAC address table overflow attack and indicates all frames are being flooded,Multiple MAC addresses on one port indicates a misconfigured trunk which is sending all VLAN traffic unsegregated,B,A switch port connected to another switch learns a MAC address for every host that communicates through that link. Hundreds of MACs on an uplink port in a multi-switch network is normal and expected. It would only be a concern if unknown addresses appear (rogue devices) or if the numbers exceed expected host counts.,multiple macs on one port,multiple macs on uplink port is normal; each represents one reachable downstream host,/home/citadel/Documents/citavault/NETC-121/Notes List B - Textbook Content/Textbook 1 - Chapter 3 Switches, Routers, and VLANs/Book 1 Chapter 3 - Switches, Routers, and VLANs.md
hard,A router-on-a-stick configuration has subinterface fa0/0.10 with encapsulation dot1Q 10 and IP 192.168.10.1 and subinterface fa0/0.20 with encapsulation dot1Q 20 and IP 192.168.20.1. A host in VLAN 10 (IP 192.168.10.5) sends a packet to a host in VLAN 20 (IP 192.168.20.10). Trace the exact Layer 2 and Layer 3 steps.,The switch inspects the IP destination and routes between VLANs directly without involving the router,Host sends untagged frame; router receives it; adds VLAN 20 tag; sends back to the switch; switch delivers to VLAN 20 host,Host ARPs for gateway 192.168.10.1; gets router MAC; sends Ethernet frame (src: host10 MAC; dst: router MAC; VLAN 10 tag on trunk) to router; router decapsulates; routes to 192.168.20.10; ARP for host20 MAC; sends Ethernet frame (VLAN 20 tag) to switch; switch delivers to host20 access port stripped of tag,Host sends frame directly to VLAN 20 destination IP; switch sees the IP and forwards it using VLAN 20 MAC table entry,C,Step-by-step: (1) host10 ARPs for 192.168.10.1 (gateway); switch forwards to trunk; router responds on fa0/0.10; (2) host10 sends IP packet in Ethernet frame (dst MAC = router; dot1Q VLAN 10 tag on trunk); (3) router receives on fa0/0.10; strips L2; sees IP dst 192.168.20.10; routes to fa0/0.20; (4) router ARPs for host20 on VLAN 20; (5) router sends frame tagged VLAN 20; switch strips tag on access port; delivers to host20.,router-on-a-stick definition,router-on-a-stick inter-vlan routing path involves arp gateway mac routing and re-tagging,/home/citadel/Documents/citavault/NETC-121/Notes List A - Video Content/Video 17 - Trunking and 802.1Q/Transcript.md
hard,Why does a MAC address table overflow attack (MAC flooding) cause a switch to behave like a hub and what is the security consequence?,MAC flooding removes all VLAN assignments from the MAC table causing the switch to assign all ports to VLAN 1 and flood all frames within VLAN 1,MAC flooding causes the switch CPU to restart which temporarily disables all 802.1Q tagging turning trunk ports into access ports,When the MAC table is full the switch cannot learn new MAC addresses and must flood all subsequent unknown unicast frames out all ports in the VLAN allowing an attacker on any port to capture traffic intended for other devices,MAC flooding corrupts the FCS on all frames causing all devices to retransmit simultaneously overwhelming the switch buffer,C,Switch MAC tables have finite size. An attacker sends thousands of frames with random source MACs filling the table. Now when legitimate frames arrive the switch cannot find the destination in the (full) table so it floods — like a hub. All devices in the VLAN receive all unicast traffic enabling passive capture. Port-security mitigates this by limiting learned MACs per port.,switch learning,mac table overflow forces flooding of all unicast frames enabling traffic capture,/home/citadel/Documents/citavault/NETC-121/Notes List B - Textbook Content/Textbook 1 - Chapter 3 Switches, Routers, and VLANs/Book 1 Chapter 3 - Switches, Routers, and VLANs.md
hard,How does NAT return traffic work in detail when multiple internal hosts simultaneously access the same external web server?,The router sends all replies to the host that made the most recent request dropping the others,The router uses the VLAN ID from the original request to identify which internal host should receive each reply,The router broadcasts each reply to all internal hosts and each host accepts only the packet with its own IP,The router tracks source IP; source port; and translated port for each session so each reply is uniquely mapped back to the correct internal host using the port-session table,D,NAT maintains a session table: each entry stores (internal IP; internal port; external IP; external port; translated port). Multiple hosts contacting the same server will each have a unique translated port. When replies arrive the router matches the destination port to the session table and restores the correct internal IP and port before forwarding inward.,nat session tracking,nat uses port-session table to demultiplex replies from same server to multiple internal hosts,/home/citadel/Documents/citavault/NETC-121/Notes List B - Textbook Content/Textbook 1 - Chapter 3 Switches, Routers, and VLANs/Book 1 Chapter 3 - Switches, Routers, and VLANs.md
hard,A network has departments A and B on the same physical switch. Department A must never be able to send or receive traffic from Department B at any layer. What is the design requirement and why is VLAN isolation alone insufficient?,VLANs alone are sufficient because they prevent all Layer 2 and Layer 3 communication between the segments,NAT between VLANs provides absolute isolation; VLAN segmentation is only needed for broadcast reduction,Assign both departments to different VLANs with different subnets and do not configure inter-VLAN routing between them; VLAN isolation prevents Layer 2 communication; and without a routing path there is no Layer 3 path either — combined this achieves network-layer isolation; physical isolation is only needed for absolute air-gap requirements,VLAN isolation is sufficient at Layer 2 but each VLAN needs its own dedicated switch to prevent Layer 1 crosstalk,C,VLANs isolate Layer 2. Without inter-VLAN routing (no router between the VLANs; no Layer 3 switch routing between them) there is also no Layer 3 path. Together this achieves network isolation. If absolute air-gap is needed (no shared hardware at all) then physically separate switches are required — but that is not usually mandated by network policy alone.,physical vs vlan separation,vlan plus no routing path achieves network isolation; air-gap requires physical separation,/home/citadel/Documents/citavault/NETC-121/Notes List A - Video Content/Video 16 - VLANs Made Easy/Transcript.md
hard,What is the full sequence of DTP negotiation outcomes for all three mode combinations and what is the hardcoded trunk caveat?,Auto+Auto forms a trunk; Desirable+Auto does not; Desirable+Desirable forms a trunk; hardcoded trunks never send DTP,Auto+Auto forms a trunk; Desirable+Auto forms a trunk; Desirable+Desirable forms a trunk; hardcoded trunks suppress all DTP messages,Auto+Auto does not form a trunk; Desirable+Auto forms a trunk; Desirable+Desirable forms a trunk; hardcoded trunks may still send DTP frames unless switchport nonegotiate is added,Auto+Auto forms a trunk only if VLANs match; Desirable+Auto always forms a trunk; Desirable+Desirable requires VTP server acknowledgment,C,DTP outcomes: Auto+Auto = no trunk (neither side negotiates). Desirable+Auto = trunk (desirable initiates; auto accepts). Desirable+Desirable = trunk (both negotiate). Hardcoded (switchport mode trunk): port is a trunk but Cisco IOS may still send DTP frames. switchport nonegotiate suppresses all DTP messages from hardcoded trunk ports.,dtp negotiation outcomes,auto-auto no trunk; desirable-auto trunk; desirable-desirable trunk; hardcoded still sends dtp,/home/citadel/Documents/citavault/NETC-121/Notes List B - Textbook Content/Textbook 1 - Chapter 3 Switches, Routers, and VLANs/Book 1 Chapter 3 - Switches, Routers, and VLANs.md
hard,How does VTP's revision number system become a catastrophic risk when a used switch is added to a production network?,VTP revision numbers cause the switch to block all trunk links until a new election cycle completes disrupting production traffic,VTP revision numbers are only used for authentication; a used switch with a known revision number cannot affect the VLAN database,A used switch with a higher VTP revision number will push its VLAN database to all VTP client switches in the domain overwriting the production VLAN database and potentially deleting all existing VLANs causing widespread outages,VTP revision numbers only affect newly created VLANs; existing production VLANs are protected from overwrite by the revision system,C,VTP uses revision numbers to determine which database is most recent. VTP clients accept the highest revision number they see. If a used switch with many prior VLAN configurations has a higher revision number it becomes the authoritative source — all VTP clients adopt its VLAN database. If that database lacks production VLANs they are deleted causing switch ports to lose VLAN assignments. Mitigation: reset revision number to 0 by changing VTP domain before connecting to production.,vtp limitation,used switch with higher revision number can overwrite production vlan database via vtp,/home/citadel/Documents/citavault/NETC-121/Notes List B - Textbook Content/Textbook 1 - Chapter 3 Switches, Routers, and VLANs/Book 1 Chapter 3 - Switches, Routers, and VLANs.md
hard,Explain why SSH public key authentication is more secure than password authentication for managing network infrastructure.,Public key authentication uses longer key lengths than passwords making brute force slower but both are equally vulnerable to packet capture,Public key authentication is more convenient but no more secure; the private key is transmitted to the server during authentication,Public key authentication eliminates the transmission of a secret over the network entirely — the server verifies a mathematical challenge using the stored public key; the private key never leaves the client device; even a fully captured session reveals nothing that can be used to authenticate,Public key authentication is less secure because anyone with the public key can impersonate the administrator,C,Password auth: the password is sent to the server (encrypted in SSH but still transmitted). A compromised server could expose it. Public key auth: the server stores only the public key. Authentication works by the client proving possession of the private key via a mathematical challenge-response. The private key never leaves the client. Even if the server is compromised the public key cannot be used to authenticate anywhere else.,ssh authentication methods,public key auth proves possession without transmitting the secret; password is transmitted,/home/citadel/Documents/citavault/NETC-121/Notes List A - Video Content/Video 10 - Telnet and SSH/Transcript.md
hard,An IP phone and a PC both connect through one switch port. The switch is configured with access VLAN 10 for data and voice VLAN 50 for voice. The IP phone is not tagging traffic. What will happen and how is this diagnosed?,The phone's untagged traffic will be placed in VLAN 10 with the PC traffic; voice quality will degrade due to shared bandwidth,The phone and PC traffic will be blocked because the switch requires tagged traffic on all ports with a voice VLAN configured,The phone's untagged traffic will be placed in VLAN 50 automatically because the voice VLAN is always the higher priority,The switch will err-disable the port because untagged traffic from the phone conflicts with the PC data VLAN,A,If the IP phone does not send tagged voice traffic (misconfiguration; wrong firmware; or CDP not working to inform the phone) all of its traffic will be untagged and fall into the data VLAN 10 along with the PC. Voice and data will share the same VLAN and QoS queue. Diagnosis: check show interfaces <id> for voice VLAN and verify the phone's VLAN assignment with show cdp neighbors.,voice vlan and phone behavior,ip phone sending untagged traffic falls into data vlan degrading voice quality,/home/citadel/Documents/citavault/NETC-121/Notes List A - Video Content/Video 17 - Trunking and 802.1Q/Transcript.md
hard,A frame arrives on a trunk port tagged with VLAN 40 but VLAN 40 is not in the switch's VLAN database. What does the switch do and what administrative action caused this?,The switch forwards the frame to all ports and lets hosts determine if VLAN 40 applies to them,The switch creates VLAN 40 dynamically so the frame is delivered correctly,The switch drops the frame; VLAN 40 traffic was likely allowed on the trunk because it was not pruned; the administrator forgot to create VLAN 40 on this switch after creating it on the VTP server,The switch sends the frame to the router on the native VLAN for VLAN 40 resolution,C,If a VLAN exists on the trunk's allowed list but is not created in the switch's VLAN database the switch drops frames for that VLAN — it has no VLAN membership to associate the traffic with. This can happen when VTP propagation fails or when the admin manually creates a VLAN on a server but VTP sync did not complete. Fix: create VLAN 40 on this switch.,vlan creation method,frames for uncreated vlans are dropped even if the vlan id is allowed on the trunk,/home/citadel/Documents/citavault/NETC-121/Notes List B - Textbook Content/Textbook 1 - Chapter 3 Switches, Routers, and VLANs/Book 1 Chapter 3 - Switches, Routers, and VLANs.md
hard,Compare the Layer 2 impact of replacing a hub with a switch on a 24-device segment in terms of collision domains; concurrent sessions; and device privacy.,Both hub and switch have 24 collision domains; the switch improves privacy by encrypting inter-device traffic,Hub: 1 collision domain; at most 1 concurrent session (CSMA/CD); all devices see all traffic. Switch: 24 collision domains; up to 12 concurrent full-duplex sessions; each frame goes only to the destination port improving privacy,Hub: 1 collision domain; all devices visible to each other. Switch: 1 collision domain; frames still reach all devices but privacy is improved by limiting flooding,Hub and switch have identical collision domains; the switch improvement is speed only,B,Hub: all 24 devices in 1 collision domain; CSMA/CD allows only 1 transmission at a time across the entire segment; all devices receive all traffic (privacy risk). Switch: 24 separate collision domains (1 per port link); multiple simultaneous point-to-point sessions; frames sent only to destination port protecting privacy and multiplying available bandwidth.,switch vs hub impact,switch creates 24 collision domains enables concurrent sessions and limits frame visibility,/home/citadel/Documents/citavault/NETC-121/Notes List B - Textbook Content/Textbook 1 - Chapter 3 Switches, Routers, and VLANs/Book 1 Chapter 3 - Switches, Routers, and VLANs.md
hard,An attacker plugs into a switch port in DTP desirable mode and sends DTP negotiate frames. What sequence of events leads to VLAN hopping access and what is the most effective mitigation?,The attacker gains access to VLAN 1 only because trunk negotiation always places the attacker in the native VLAN regardless of tag crafting,DTP desirable mode cannot form a trunk without administrator confirmation so the attack fails at the negotiation phase,Attacker sends DTP frames; port in desirable mode accepts and transitions to trunk mode; attacker configures 802.1Q on their device; attacker sends and receives tagged frames for all VLANs on the trunk; mitigation: configure switchport mode access on all end-user ports,The attacker can form a trunk only if the VTP domain name matches; changing the VTP domain name mitigates trunk negotiation attacks,C,Attack sequence: (1) attacker sends DTP negotiation frames from rogue device; (2) switch port in desirable mode responds and both sides agree to trunk; (3) attacker configures 802.1Q on their NIC or software; (4) attacker receives all VLAN traffic on the trunk. Mitigation: switchport mode access disables DTP entirely on that port — no negotiation is possible.,vlan hopping attack,dtp desirable port negotiates trunk with attacker; fixed by hard-coding access mode,/home/citadel/Documents/citavault/NETC-121/Notes List B - Textbook Content/Textbook 1 - Chapter 3 Switches, Routers, and VLANs/Book 1 Chapter 3 - Switches, Routers, and VLANs.md
hard,How does ARP interact with the switch MAC table in a scenario where Host A (192.168.1.10) sends the first packet ever to Host B (192.168.1.20) both in VLAN 10?,Host A sends IP packet directly; the switch routes it using the destination IP ignoring MAC,Host A sends a unicast ARP request to Host B's IP; the switch forwards it directly using MAC; Host B responds,Host A broadcasts an ARP request with destination MAC FF-FF-FF-FF-FF-FF asking who has 192.168.1.20; the switch floods it within VLAN 10; Host B replies with its MAC; the switch learns Host B's MAC on its port; Host A now has Host B's MAC and sends the unicast IP packet directly,Host A sends the IP packet to the router default gateway which ARP-resolves Host B's MAC and delivers it,C,ARP-to-switch interaction: (1) Host A has no MAC for 192.168.1.20; broadcasts ARP (dst FF:FF:FF:FF:FF:FF) in VLAN 10; (2) switch sees ARP on Host A's port — learns Host A MAC; floods ARP out all VLAN 10 ports; (3) Host B receives ARP; replies unicast to Host A MAC — switch learns Host B MAC on its port; (4) Host A now has Host B's MAC; sends unicast frame; switch forwards directly.,arp broadcast behavior,arp broadcast triggers flooding then learning so future unicast frames are forwarded directly,/home/citadel/Documents/citavault/NETC-121/Notes List B - Textbook Content/Textbook 1 - Chapter 3 Switches, Routers, and VLANs/Book 1 Chapter 3 - Switches, Routers, and VLANs.md
hard,A company grows from one switch to five switches with a shared inter-switch trunk infrastructure. All switches are in one large flat VLAN 1. What performance and security problems emerge and what is the solution?,The primary problem is switch CPU overload from managing five separate MAC tables; VLANs fix this by merging MAC tables,Flat VLAN 1 across five switches means one large broadcast domain; all ARP; DHCP; and broadcast traffic from all hosts reaches all devices simultaneously consuming bandwidth; any host can sniff or spoof any other at Layer 2; solution is to segment into multiple VLANs with routers providing inter-VLAN routing,Flat VLAN 1 causes spanning-tree instability because all five switches compete for root bridge; VLANs fix this by running per-switch spanning tree,Flat VLAN 1 forces all five switches into DTP auto mode creating uncontrolled trunk negotiation across the domain,B,Five switches in one flat VLAN 1: broadcasts (ARP; DHCP; etc.) flood all five switches reaching every host regardless of department. A sniffer anywhere captures all broadcast traffic and potentially unicast too (via ARP poisoning). Performance: as hosts grow broadcasts consume a growing share of bandwidth. Solution: segment into multiple VLANs matching department boundaries with routers/Layer 3 switches handling inter-VLAN traffic.,broadcast overhead problem,flat vlan 1 across all switches creates large broadcast domain with security and performance problems,/home/citadel/Documents/citavault/NETC-121/Notes List A - Video Content/Video 16 - VLANs Made Easy/Transcript.md
hard,What are the exact Layer 2 events when Host A on SW1 sends traffic to Host B on SW2 both in VLAN 10 connected by a trunk link and Host B's MAC is unknown to SW1?,Host A sends a tagged frame; SW1 strips the tag; SW2 looks up the destination MAC and forwards to Host B,Host A sends a unicast frame; SW1 checks its MAC table; finds Host B unknown; floods within VLAN 10 including out the trunk (802.1Q-tagged); SW2 receives the tagged frame; recognizes it as VLAN 10; floods it to all VLAN 10 ports; Host B replies; SW1 and SW2 both learn Host B's MAC,SW1 queries SW2's MAC table over the trunk before forwarding to avoid flooding,Host A sends a broadcast which SW1 forwards untagged to SW2; SW2 converts it to unicast using its own MAC table,B,Event sequence: (1) SW1 receives frame from Host A on VLAN 10 access port; learns Host A MAC; (2) destination Host B MAC is unknown to SW1; (3) SW1 floods within VLAN 10 — includes all VLAN 10 access ports and the trunk; (4) frame exits SW1 trunk tagged 802.1Q VLAN 10; (5) SW2 receives tagged frame; VLAN 10 match; floods to all VLAN 10 access ports; (6) Host B receives; replies; (7) both switches learn Host B's MAC on its respective port.,switch learning,unknown unicast floods across trunk tagged; both switches learn source macs from reply,/home/citadel/Documents/citavault/NETC-121/Notes List A - Video Content/Video 17 - Trunking and 802.1Q/Transcript.md
hard,Why does a standard Layer 2 switch not need an IP address to forward Ethernet frames yet still requires one in practice?,Switches need an IP address because MAC address lookup is replaced by IP routing in the switch hardware,Switches need an IP address because 802.1Q tagging is an IP-layer operation requiring an IP source address in the tag,A switch forwards frames based on MAC addresses only and does not need an IP address to do so; however managed switches need a management IP address (configured on an SVI) to allow administrators to reach the switch remotely via Telnet or SSH for configuration and monitoring,Switches need an IP address only when VLANs are configured because VLAN frames require an IP header for VLAN ID resolution,C,Layer 2 forwarding is MAC-based — no IP needed. But without a management IP no one can SSH or Telnet to the switch to configure it; troubleshoot it; or monitor it remotely. Administrators configure an IP on the management VLAN SVI (interface vlan 1) and set a default gateway so the switch is reachable from anywhere on the network.,managed switch addressing requirement,switch forwards by mac without ip but needs management ip for remote administration,/home/citadel/Documents/citavault/NETC-121/Notes List B - Textbook Content/Textbook 1 - Chapter 3 Switches, Routers, and VLANs/Book 1 Chapter 3 - Switches, Routers, and VLANs.md
hard,A network administrator realizes that the Cisco switch connecting the accounting VLAN to the rest of the network has its port in DTP auto mode. Accounting contains financial data. Describe the threat and the full remediation.,Change the native VLAN on the trunk and add a firewall ACL to block inter-VLAN accounting access,The threat is ARP poisoning; remediation is to enable dynamic ARP inspection on the accounting VLAN,The threat is an attacker on any port adjacent to accounting negotiating a trunk and receiving all accounting VLAN traffic; remediation: set all access ports to switchport mode access; set all trunk ports to switchport mode trunk and switchport nonegotiate; move native VLAN to an unused VLAN to prevent double-tag hopping,The threat is VTP revision number corruption; remediation is to set VTP transparent mode on the accounting switch,C,Threat: any device connected to an auto-mode port can trigger DTP trunk formation — including ports adjacent to accounting. Once trunked the attacker receives 802.1Q-tagged frames for all VLANs including accounting. Remediation: (1) switchport mode access on all access ports (disables DTP); (2) switchport mode trunk + switchport nonegotiate on all uplinks (disables DTP response); (3) change native VLAN to unused ID (prevents double-tagging attack).,vlan hopping attack,dtp auto on accounting ports enables trunk negotiation; fix by hard-coding access and nonegotiate,/home/citadel/Documents/citavault/NETC-121/Notes List B - Textbook Content/Textbook 1 - Chapter 3 Switches, Routers, and VLANs/Book 1 Chapter 3 - Switches, Routers, and VLANs.md
