"difficulty","question","choice_a","choice_b","choice_c","choice_d","correct_choice","explanation","concept_key","aspect_key","source_path"
"medium","What is a root port in STP?","A port on the root bridge that is always blocked","The best path from a non-root switch to the root","A port used only for DHCP traffic","A port assigned to the native VLAN","B","A root port is the best path from a non-root switch to the root bridge.","stp","root port definition","/home/citadel/Documents/citavault/NETC-121/rocket-questions-html/courses/NETC-121/notes-content/Notes List D - Alex's Final Exam Preparation/STUDY GUIDE 1.md"
"medium","What is a designated port in STP?","A port that provides forwarding for a network segment","A port that must always be shut down","A port reserved for routing protocols","A port used to store MAC addresses","A","A designated port is the forwarding port for a network segment.","stp","designated port definition","/home/citadel/Documents/citavault/NETC-121/rocket-questions-html/courses/NETC-121/notes-content/Notes List D - Alex's Final Exam Preparation/STUDY GUIDE 1.md"
"medium","What is the job of a blocked port in STP?","To forward only multicast traffic","To prevent forwarding that would create a loop","To answer ARP requests","To advertise default routes","B","A blocked port prevents forwarding that would create a loop.","stp","blocked port definition","/home/citadel/Documents/citavault/NETC-121/rocket-questions-html/courses/NETC-121/notes-content/Notes List D - Alex's Final Exam Preparation/STUDY GUIDE 1.md"
"medium","Which STP state receives BPDUs and does not forward normal user traffic?","Forwarding","Listening","Blocking","Disabled","C","The Blocking state receives BPDUs and does not forward user traffic.","stp states","blocking state","/home/citadel/Documents/citavault/NETC-121/rocket-questions-html/courses/NETC-121/notes-content/Notes List D - Alex's Final Exam Preparation/STUDY GUIDE 1.md"
"medium","Which STP state prepares for forwarding but does not learn MAC addresses yet?","Listening","Learning","Disabled","Root","A","Listening prepares for forwarding and does not yet learn MAC addresses.","stp states","listening state","/home/citadel/Documents/citavault/NETC-121/rocket-questions-html/courses/NETC-121/notes-content/Notes List D - Alex's Final Exam Preparation/STUDY GUIDE 1.md"
"medium","Which STP state learns MAC addresses but still does not forward user traffic?","Blocking","Listening","Learning","Disabled","C","The Learning state learns MAC addresses but does not yet forward normal user traffic.","stp states","learning state","/home/citadel/Documents/citavault/NETC-121/rocket-questions-html/courses/NETC-121/notes-content/Notes List D - Alex's Final Exam Preparation/STUDY GUIDE 1.md"
"medium","Which STP state forwards user traffic normally?","Disabled","Forwarding","Blocking","Learning","B","The Forwarding state forwards user traffic normally.","stp states","forwarding state","/home/citadel/Documents/citavault/NETC-121/rocket-questions-html/courses/NETC-121/notes-content/Notes List D - Alex's Final Exam Preparation/STUDY GUIDE 1.md"
"medium","Which STP state describes an administratively down or inactive port?","Forwarding","Learning","Listening","Disabled","D","The Disabled state is administratively down or inactive.","stp states","disabled state","/home/citadel/Documents/citavault/NETC-121/rocket-questions-html/courses/NETC-121/notes-content/Notes List D - Alex's Final Exam Preparation/STUDY GUIDE 1.md"
"medium","What is the default STP hello time listed in the guide?","1 second","2 seconds","15 seconds","20 seconds","B","The guide lists the hello timer as 2 seconds.","stp timers","hello timer","/home/citadel/Documents/citavault/NETC-121/rocket-questions-html/courses/NETC-121/notes-content/Notes List D - Alex's Final Exam Preparation/STUDY GUIDE 1.md"
"medium","What is the default STP max-age time listed in the guide?","2 seconds","10 seconds","15 seconds","20 seconds","D","The guide lists max age as 20 seconds.","stp timers","max age","/home/citadel/Documents/citavault/NETC-121/rocket-questions-html/courses/NETC-121/notes-content/Notes List D - Alex's Final Exam Preparation/STUDY GUIDE 1.md"
"medium","What is the classic STP forward-delay timer value listed in the guide?","5 seconds","10 seconds","15 seconds","30 seconds","C","The classic STP forward-delay timer value is 15 seconds.","stp timers","forward delay value","/home/citadel/Documents/citavault/NETC-121/rocket-questions-html/courses/NETC-121/notes-content/Notes List D - Alex's Final Exam Preparation/STUDY GUIDE 1.md"
"medium","What does VLAN stand for?","Virtual LAN Assignment Layer","Virtual Local Area Network","Verified Local Access Number","Variable Link Access Network","B","VLAN stands for Virtual Local Area Network.","vlan","full form","/home/citadel/Documents/citavault/NETC-121/rocket-questions-html/courses/NETC-121/notes-content/Notes List D - Alex's Final Exam Preparation/STUDY GUIDE 1.md"
"medium","What does a VLAN create at Layer 2?","A collision domain only","A separate broadcast domain","A DNS zone","A TCP session","B","A VLAN creates a separate broadcast domain at Layer 2.","vlan","broadcast domain","/home/citadel/Documents/citavault/NETC-121/rocket-questions-html/courses/NETC-121/notes-content/Notes List D - Alex's Final Exam Preparation/STUDY GUIDE 1.md"
"medium","What is required for devices in different VLANs to communicate?","Only a hub","Only an ARP table","A Layer 3 device","Only a faster switch port","C","Inter-VLAN communication requires a Layer 3 device.","vlan","inter-vlan requirement","/home/citadel/Documents/citavault/NETC-121/rocket-questions-html/courses/NETC-121/notes-content/Notes List D - Alex's Final Exam Preparation/STUDY GUIDE 1.md"
"medium","Which standard is used for VLAN tagging on trunks?","802.11","802.1Q","802.3af","802.1D","B","802.1Q is the VLAN tagging standard used on trunks.","trunking","802.1q standard","/home/citadel/Documents/citavault/NETC-121/rocket-questions-html/courses/NETC-121/notes-content/Notes List D - Alex's Final Exam Preparation/STUDY GUIDE 1.md"
"medium","What kind of port typically carries exactly one VLAN for an endpoint?","Trunk port","Access port","Console port","Root port","B","An access port carries one VLAN for an endpoint.","trunking","access port","/home/citadel/Documents/citavault/NETC-121/rocket-questions-html/courses/NETC-121/notes-content/Notes List D - Alex's Final Exam Preparation/STUDY GUIDE 1.md"
"medium","What kind of port typically carries multiple VLANs?","Blocked port","Access port","Trunk port","Disabled port","C","A trunk port carries multiple VLANs.","trunking","trunk port","/home/citadel/Documents/citavault/NETC-121/rocket-questions-html/courses/NETC-121/notes-content/Notes List D - Alex's Final Exam Preparation/STUDY GUIDE 1.md"
"medium","What is the native VLAN on a trunk according to the guide?","The VLAN that is routed first","The VLAN sent untagged by default","The VLAN reserved for ARP only","The VLAN with the highest ID","B","The native VLAN is sent untagged on a trunk by default.","trunking","native vlan","/home/citadel/Documents/citavault/NETC-121/rocket-questions-html/courses/NETC-121/notes-content/Notes List D - Alex's Final Exam Preparation/STUDY GUIDE 1.md"
"medium","When does a host use its default gateway?","For all local traffic","When the destination is not on the local subnet","Only during DHCP","Only when using multicast","B","A host uses its default gateway for remote destinations.","routing fundamentals","default gateway use","/home/citadel/Documents/citavault/NETC-121/rocket-questions-html/courses/NETC-121/notes-content/Notes List D - Alex's Final Exam Preparation/STUDY GUIDE 1.md"
"medium","When does a router use a default route?","When a more specific route is missing","When an ARP entry is missing","Only when DHCP fails","Only on VLAN 1","A","A router uses a default route when no more specific route matches.","routing fundamentals","default route use","/home/citadel/Documents/citavault/NETC-121/rocket-questions-html/courses/NETC-121/notes-content/Notes List D - Alex's Final Exam Preparation/STUDY GUIDE 1.md"
"medium","What is a next hop in routing?","The source MAC address","The next router or interface a packet should be sent to","The first DNS server in a list","The switch port with the native VLAN","B","The next hop is the next router or interface in the path.","routing fundamentals","next hop","/home/citadel/Documents/citavault/NETC-121/rocket-questions-html/courses/NETC-121/notes-content/Notes List D - Alex's Final Exam Preparation/STUDY GUIDE 1.md"
"medium","What is another common name for the default route on a router?","Root path","Gateway of last resort","Access gateway","Routing bridge","B","The default route is often called the gateway of last resort.","routing fundamentals","gateway of last resort","/home/citadel/Documents/citavault/NETC-121/rocket-questions-html/courses/NETC-121/notes-content/Notes List D - Alex's Final Exam Preparation/STUDY GUIDE 1.md"
"medium","What type of route appears automatically when an interface is configured on a router?","Connected route","Floating route","External route","Summarized route","A","A connected route appears automatically when an interface is configured.","routing fundamentals","connected route","/home/citadel/Documents/citavault/NETC-121/rocket-questions-html/courses/NETC-121/notes-content/Notes List D - Alex's Final Exam Preparation/STUDY GUIDE 1.md"
"medium","What type of route is manually entered by an administrator?","Connected route","Static route","Default MAC route","Learning route","B","A static route is manually entered by an administrator.","routing fundamentals","static route","/home/citadel/Documents/citavault/NETC-121/rocket-questions-html/courses/NETC-121/notes-content/Notes List D - Alex's Final Exam Preparation/STUDY GUIDE 1.md"
"medium","What type of route is learned from a routing protocol?","Connected route","Static route","Dynamic route","Looped route","C","A dynamic route is learned from a routing protocol.","routing fundamentals","dynamic route","/home/citadel/Documents/citavault/NETC-121/rocket-questions-html/courses/NETC-121/notes-content/Notes List D - Alex's Final Exam Preparation/STUDY GUIDE 1.md"
"medium","What is route summarization?","Breaking one large route into many small routes","Combining several smaller routes into one larger route","Replacing IP routing with MAC forwarding","Using a default route only","B","Route summarization combines several smaller routes into one larger route.","route summarization","definition","/home/citadel/Documents/citavault/NETC-121/rocket-questions-html/courses/NETC-121/notes-content/Notes List D - Alex's Final Exam Preparation/STUDY GUIDE 1.md"
"medium","Why is route summarization useful?","It increases the number of routes in a table","It makes VLAN tags longer","It reduces routing-table size and routing overhead","It turns static routes into MAC addresses","C","Summarization reduces routing-table size and routing overhead.","route summarization","benefits","/home/citadel/Documents/citavault/NETC-121/rocket-questions-html/courses/NETC-121/notes-content/Notes List D - Alex's Final Exam Preparation/STUDY GUIDE 1.md"
"medium","What metric does RIP use to compare routes?","Bandwidth","Hop count","Delay only","VLAN ID","B","RIP uses hop count as its metric.","rip","hop count","/home/citadel/Documents/citavault/NETC-121/rocket-questions-html/courses/NETC-121/notes-content/Notes List D - Alex's Final Exam Preparation/STUDY GUIDE 1.md"
"medium","Which version of RIP is classful?","RIP v2","RIPng","RIP v1","EIGRP","C","RIP v1 is classful.","rip","version 1 classful","/home/citadel/Documents/citavault/NETC-121/rocket-questions-html/courses/NETC-121/notes-content/Notes List D - Alex's Final Exam Preparation/STUDY GUIDE 1.md"
"medium","Which version of RIP includes subnet mask information?","RIP v1","RIP v2","IGRP","ICMP","B","RIP v2 includes subnet mask information.","rip","version 2 subnet masks","/home/citadel/Documents/citavault/NETC-121/rocket-questions-html/courses/NETC-121/notes-content/Notes List D - Alex's Final Exam Preparation/STUDY GUIDE 1.md"
"medium","Which routing protocol in the guide is link-state?","RIP","IGRP","OSPF","ARP","C","OSPF is a link-state protocol.","routing protocols","ospf type","/home/citadel/Documents/citavault/NETC-121/rocket-questions-html/courses/NETC-121/notes-content/Notes List D - Alex's Final Exam Preparation/STUDY GUIDE 1.md"
"medium","Which routing protocol in the guide is distance-vector?","OSPF","IGRP","STP","ARP","B","IGRP is a distance-vector protocol in the guide comparison.","routing protocols","igrp type","/home/citadel/Documents/citavault/NETC-121/rocket-questions-html/courses/NETC-121/notes-content/Notes List D - Alex's Final Exam Preparation/STUDY GUIDE 1.md"
"hard","Which OSI layer is associated with translation encryption and compression?","Session","Presentation","Transport","Network","B","The Presentation layer handles translation encryption and compression.","osi model","presentation functions","/home/citadel/Documents/citavault/NETC-121/rocket-questions-html/courses/NETC-121/notes-content/Notes List D - Alex's Final Exam Preparation/STUDY GUIDE 1.md"
"hard","Which OSI layer is responsible for starting and managing sessions between endpoints?","Session","Transport","Application","Data Link","A","The Session layer starts and manages sessions.","osi model","session functions","/home/citadel/Documents/citavault/NETC-121/rocket-questions-html/courses/NETC-121/notes-content/Notes List D - Alex's Final Exam Preparation/STUDY GUIDE 1.md"
"hard","Which Transport-layer PDU term is commonly associated with UDP instead of TCP?","Frame","Packet","Datagram","Bit","C","UDP commonly uses the term datagram at the Transport layer.","transport layer","udp datagram","/home/citadel/Documents/citavault/NETC-121/rocket-questions-html/courses/NETC-121/notes-content/Notes List D - Alex's Final Exam Preparation/STUDY GUIDE 1.md"
"hard","Why did classful addressing tend to waste addresses?","It used MAC addresses instead of IP addresses","It forced fixed default mask sizes even when organizations needed different network sizes","It prevented use of DNS","It removed the host portion of an address","B","Classful addressing wasted addresses because fixed default mask sizes were less flexible than CIDR.","classful addressing","address waste","/home/citadel/Documents/citavault/NETC-121/rocket-questions-html/courses/NETC-121/notes-content/Notes List D - Alex's Final Exam Preparation/STUDY GUIDE 1.md"
"hard","What does a /8 route require for a match?","The first 8 bits of the destination must match","Any 8 host bits may differ","Only the last 8 bits must match","Exactly 8 routers must exist","A","A /8 route matches the first 8 bits of the destination.","cidr","slash 8 match","/home/citadel/Documents/citavault/NETC-121/rocket-questions-html/courses/NETC-121/notes-content/Notes List D - Alex's Final Exam Preparation/STUDY GUIDE 1.md"
"hard","What does a /16 route require for a match?","Only the last 16 bits must match","The first 16 bits of the destination must match","Exactly 16 hosts must exist","The default gateway must be blank","B","A /16 route matches the first 16 bits of the destination.","cidr","slash 16 match","/home/citadel/Documents/citavault/NETC-121/rocket-questions-html/courses/NETC-121/notes-content/Notes List D - Alex's Final Exam Preparation/STUDY GUIDE 1.md"
"hard","What does a /24 route require for a match?","The host portion must be all zeros","The first 24 bits of the destination must match","The route can only be private","The VLAN must equal 24","B","A /24 route matches the first 24 bits of the destination.","cidr","slash 24 match deeper","/home/citadel/Documents/citavault/NETC-121/rocket-questions-html/courses/NETC-121/notes-content/Notes List D - Alex's Final Exam Preparation/STUDY GUIDE 1.md"
"hard","How many usable host addresses are typically available in a /30 subnet?","1","2","6","14","B","A typical /30 network has 4 total addresses and 2 usable host addresses.","subnetting","slash 30 usable hosts","/home/citadel/Documents/citavault/NETC-121/rocket-questions-html/courses/NETC-121/notes-content/Notes List D - Alex's Final Exam Preparation/STUDY GUIDE 1.md"
"hard","Why does a /0 default route match any destination?","Because the first 32 bits must match","Because it requires zero bits to match","Because it always points to the loopback address","Because it uses the broadcast address","B","A /0 route matches any destination because zero bits are required to match.","routing fundamentals","default route match logic","/home/citadel/Documents/citavault/NETC-121/rocket-questions-html/courses/NETC-121/notes-content/Notes List D - Alex's Final Exam Preparation/STUDY GUIDE 1.md"
"hard","What does an APIPA address usually imply about the host's DHCP process?","The host successfully renewed a lease","The host did not receive a DHCP lease and self-assigned an address","The host joined a private VLAN","The host received a static route from DNS","B","An APIPA address usually means DHCP failed and the host self-assigned an address.","dhcp","apipa implication","/home/citadel/Documents/citavault/NETC-121/rocket-questions-html/courses/NETC-121/notes-content/Notes List D - Alex's Final Exam Preparation/STUDY GUIDE 1.md"
"hard","When a destination is on a remote subnet what MAC address does a host usually need on the local link?","The final destination MAC address","The default gateway MAC address","The root bridge MAC address","The DNS server MAC address","B","For a remote subnet the host needs the MAC address of the default gateway on the local link.","routing situations","remote subnet first step","/home/citadel/Documents/citavault/NETC-121/rocket-questions-html/courses/NETC-121/notes-content/Notes List D - Alex's Final Exam Preparation/STUDY GUIDE 1.md"
"hard","When a destination is on the same subnet what MAC address does a host usually need first?","The default gateway MAC address","The root bridge MAC address","The destination host MAC address","The RIP neighbor MAC address","C","For a same-subnet destination the host usually needs the destination host MAC address.","routing situations","same subnet first step","/home/citadel/Documents/citavault/NETC-121/rocket-questions-html/courses/NETC-121/notes-content/Notes List D - Alex's Final Exam Preparation/STUDY GUIDE 1.md"
"hard","What statement correctly compares collision domains and broadcast domains in a switched VLAN network?","A switch port can be its own collision domain while a VLAN remains the broadcast domain","Collision domains and broadcast domains are always identical","Routers expand broadcast domains","A hub creates a separate broadcast domain on each port","A","Switch ports separate collision domains while a VLAN defines the Layer 2 broadcast domain.","switching","collision versus broadcast domains","/home/citadel/Documents/citavault/NETC-121/rocket-questions-html/courses/NETC-121/notes-content/Notes List D - Alex's Final Exam Preparation/STUDY GUIDE 1.md"
"hard","Why is a switch considered more efficient than a hub for normal Ethernet traffic?","A switch forwards frames toward the correct MAC destination instead of repeating all traffic out every port","A switch eliminates the need for IP addresses","A switch assigns DNS names locally","A switch disables ARP broadcasts","A","A switch forwards toward the correct MAC destination instead of repeating all traffic everywhere like a hub.","switching","efficiency reason","/home/citadel/Documents/citavault/NETC-121/rocket-questions-html/courses/NETC-121/notes-content/Notes List D - Alex's Final Exam Preparation/STUDY GUIDE 1.md"
"hard","Which statement best describes the role of an ARP request?","It maps a MAC address to a switch port","It asks for the MAC address that matches a known IPv4 address on the local network","It builds a routing table for remote networks","It advertises the native VLAN on a trunk","B","An ARP request asks which MAC address matches a known IPv4 address on the local network.","arp","arp request function","/home/citadel/Documents/citavault/NETC-121/rocket-questions-html/courses/NETC-121/notes-content/Notes List D - Alex's Final Exam Preparation/STUDY GUIDE 1.md"
"hard","What alternate name is commonly used for the CAM table on a switch?","ARP cache","Forwarding database","Default route table","Lease scope list","B","The CAM table is also commonly called the forwarding database.","cam table","forwarding database","/home/citadel/Documents/citavault/NETC-121/rocket-questions-html/courses/NETC-121/notes-content/Notes List D - Alex's Final Exam Preparation/STUDY GUIDE 1.md"
"hard","What does the N in the console shorthand 9600 8N1 mean?","Native VLAN","No parity","Network layer","No routing","B","The N in 8N1 means no parity.","console settings","no parity","/home/citadel/Documents/citavault/NETC-121/rocket-questions-html/courses/NETC-121/notes-content/Notes List D - Alex's Final Exam Preparation/STUDY GUIDE 1.md"
"hard","What does the 1 in the console shorthand 9600 8N1 mean?","1 VLAN","1 route","1 stop bit","1 data byte","C","The 1 in 8N1 means 1 stop bit.","console settings","stop bit","/home/citadel/Documents/citavault/NETC-121/rocket-questions-html/courses/NETC-121/notes-content/Notes List D - Alex's Final Exam Preparation/STUDY GUIDE 1.md"
"hard","How long can classic STP take to fully converge into forwarding according to the guide?","About 15 seconds","About 20 seconds","About 30 seconds","About 50 seconds","D","The guide notes that classic STP can take about 50 seconds to fully converge.","stp","classic convergence","/home/citadel/Documents/citavault/NETC-121/rocket-questions-html/courses/NETC-121/notes-content/Notes List D - Alex's Final Exam Preparation/STUDY GUIDE 1.md"
"hard","Why can VLANs improve security in a switched network?","They disable all broadcast traffic","They logically separate groups of devices into different broadcast domains","They remove the need for routers","They make every port a trunk","B","VLANs improve security by logically separating groups of devices into different broadcast domains.","vlan","security benefit","/home/citadel/Documents/citavault/NETC-121/rocket-questions-html/courses/NETC-121/notes-content/Notes List D - Alex's Final Exam Preparation/STUDY GUIDE 1.md"
"hard","Why can VLANs improve traffic control in a switched network?","They force all traffic to use one VLAN","They keep Layer 2 broadcast scope separated by VLAN","They replace CAM tables with routing tables","They convert all traffic into multicast","B","VLANs improve traffic control because each VLAN has its own broadcast scope.","vlan","traffic control benefit","/home/citadel/Documents/citavault/NETC-121/rocket-questions-html/courses/NETC-121/notes-content/Notes List D - Alex's Final Exam Preparation/STUDY GUIDE 1.md"
"hard","Why can a Layer 3 switch remove the need for an external router for inter-VLAN traffic?","It can route between VLANs internally","It disables MAC learning","It converts VLANs into subnets automatically without configuration","It acts like a hub on trunk links","A","A Layer 3 switch can route between VLANs internally.","layer 3 switch","inter-vlan routing benefit","/home/citadel/Documents/citavault/NETC-121/rocket-questions-html/courses/NETC-121/notes-content/Notes List D - Alex's Final Exam Preparation/STUDY GUIDE 1.md"
"hard","What is the main purpose of 802.1Q tags on trunk links?","To encrypt frames between switches","To let the receiving device know which VLAN a frame belongs to","To increase subnet mask length","To assign DHCP leases","B","802.1Q tags identify which VLAN a frame belongs to on trunk links.","trunking","tag purpose","/home/citadel/Documents/citavault/NETC-121/rocket-questions-html/courses/NETC-121/notes-content/Notes List D - Alex's Final Exam Preparation/STUDY GUIDE 1.md"
"hard","What problem can occur if two trunk ports disagree about the native VLAN?","The devices lose their MAC addresses permanently","Traffic can be misclassified between VLANs","The subnet mask becomes invalid","ARP stops working on all VLANs","B","A native VLAN mismatch can cause traffic to be placed in the wrong VLAN context.","trunking","native vlan mismatch","/home/citadel/Documents/citavault/NETC-121/rocket-questions-html/courses/NETC-121/notes-content/Notes List D - Alex's Final Exam Preparation/STUDY GUIDE 1.md"
"hard","Which device most often serves as the default gateway for hosts in a VLAN on a multilayer switched network?","A hub uplink port","A switch SVI or routed Layer 3 interface","A CAM table entry","A BPDU guard setting","B","On a multilayer switched network the default gateway is often an SVI or routed Layer 3 interface.","routing fundamentals","default gateway device","/home/citadel/Documents/citavault/NETC-121/rocket-questions-html/courses/NETC-121/notes-content/Notes List D - Alex's Final Exam Preparation/STUDY GUIDE 1.md"
"hard","What is the standard IPv4 notation for the default route?","255.255.255.255/32","127.0.0.1/8","0.0.0.0/0","169.254.0.0/16","C","The standard IPv4 default route notation is 0.0.0.0/0.","routing fundamentals","default route notation","/home/citadel/Documents/citavault/NETC-121/rocket-questions-html/courses/NETC-121/notes-content/Notes List D - Alex's Final Exam Preparation/STUDY GUIDE 1.md"
"hard","Why does route summarization usually improve scalability?","It makes routing tables and routing updates smaller","It converts all dynamic routes to static routes","It eliminates the need for default routes","It causes every router to learn more specific networks","A","Summarization improves scalability by reducing routing-table size and update overhead.","route summarization","scalability","/home/citadel/Documents/citavault/NETC-121/rocket-questions-html/courses/NETC-121/notes-content/Notes List D - Alex's Final Exam Preparation/STUDY GUIDE 1.md"
