"difficulty","question","choice_a","choice_b","choice_c","choice_d","correct_choice","explanation","concept_key","aspect_key","source_path"
"hard","Which capability does RIP v2 add compared with RIP v1?","Support for classless masks and VLSM","Support for link-state topology databases","Replacement of hop count with bandwidth","A requirement to use only default routes","A","RIP v2 adds support for classless masks and VLSM.","rip","v2 improvement","/home/citadel/Documents/citavault/NETC-121/rocket-questions-html/courses/NETC-121/notes-content/Notes List D - Alex's Final Exam Preparation/STUDY GUIDE 1.md"
"hard","Which statement correctly compares RIP v1 and RIP v2 delivery style?","RIP v1 uses multicast while RIP v2 uses broadcast","RIP v1 uses broadcast while RIP v2 uses multicast","Both use only unicast","Both use only anycast","B","The guide comparison notes that RIP v1 uses broadcast and RIP v2 uses multicast.","rip","broadcast versus multicast","/home/citadel/Documents/citavault/NETC-121/rocket-questions-html/courses/NETC-121/notes-content/Notes List D - Alex's Final Exam Preparation/STUDY GUIDE 1.md"
"hard","Why is OSPF commonly preferred over older distance-vector protocols in larger modern networks?","It is a link-state protocol with a more complete network view and generally faster convergence","It does not use IP addresses","It removes the need for subnetting","It can only run on Layer 2 switches","A","OSPF is commonly preferred because link-state protocols build a fuller topology view and usually converge faster.","ospf","preference reason","/home/citadel/Documents/citavault/NETC-121/rocket-questions-html/courses/NETC-121/notes-content/Notes List D - Alex's Final Exam Preparation/STUDY GUIDE 1.md"
"hard","Why is IGRP considered less modern than OSPF in the guide's comparison?","IGRP is a legacy Cisco proprietary distance-vector protocol","IGRP is the only open standard","IGRP is a DHCP extension","IGRP is a MAC-learning protocol","A","The guide frames IGRP as an older Cisco proprietary distance-vector protocol.","igrp","legacy status","/home/citadel/Documents/citavault/NETC-121/rocket-questions-html/courses/NETC-121/notes-content/Notes List D - Alex's Final Exam Preparation/STUDY GUIDE 1.md"
"hard","What do distance-vector routers share with their neighbors?","Full packet captures","Route information with neighbors","Only MAC addresses","Only VLAN IDs","B","Distance-vector protocols share route information with neighbors.","routing theory","distance vector sharing","/home/citadel/Documents/citavault/NETC-121/rocket-questions-html/courses/NETC-121/notes-content/Notes List D - Alex's Final Exam Preparation/STUDY GUIDE 1.md"
"hard","What do link-state routers build from the information they exchange?","A topology map of the network","A CAM table of every port","A DHCP scope database","A native VLAN catalog","A","Link-state routers build a topology map of the network.","routing theory","link state topology map","/home/citadel/Documents/citavault/NETC-121/rocket-questions-html/courses/NETC-121/notes-content/Notes List D - Alex's Final Exam Preparation/STUDY GUIDE 1.md"
"hard","Which routing approach usually has the more complete network view?","Distance vector","Link state","Neither ever has a network view","Only static routing","B","Link-state protocols usually have the more complete network view.","routing theory","network view comparison","/home/citadel/Documents/citavault/NETC-121/rocket-questions-html/courses/NETC-121/notes-content/Notes List D - Alex's Final Exam Preparation/STUDY GUIDE 1.md"
"hard","Which routing approach usually converges faster?","Distance vector","Link state","Static routing only","Both always converge equally","B","Link-state protocols usually converge faster than distance-vector protocols.","routing theory","convergence comparison","/home/citadel/Documents/citavault/NETC-121/rocket-questions-html/courses/NETC-121/notes-content/Notes List D - Alex's Final Exam Preparation/STUDY GUIDE 1.md"
"hard","What is the correct high-level PDU order from application data down to the wire?","Data, packet, segment, frame, bits","Data, segment, packet, frame, bits","Bits, frame, packet, segment, data","Segment, data, packet, bits, frame","B","The usual encapsulation order is data to segment to packet to frame to bits.","encapsulation","pdu order","/home/citadel/Documents/citavault/NETC-121/rocket-questions-html/courses/NETC-121/notes-content/Notes List D - Alex's Final Exam Preparation/STUDY GUIDE 1.md"
"hard","Which statement best distinguishes Layer 2 local delivery from Layer 3 routing?","Layer 2 uses MAC addresses within a LAN while Layer 3 uses IP addresses between networks","Layer 2 uses DHCP while Layer 3 uses DNS","Layer 2 always broadcasts while Layer 3 always multicasts","Layer 2 is wireless only while Layer 3 is wired only","A","Layer 2 uses MAC addresses for local delivery and Layer 3 uses IP for routing between networks.","osi model","layer 2 versus layer 3 forwarding","/home/citadel/Documents/citavault/NETC-121/rocket-questions-html/courses/NETC-121/notes-content/Notes List D - Alex's Final Exam Preparation/STUDY GUIDE 1.md"
"hard","Why does a broadcast normally stay inside one VLAN?","Because a VLAN is a Layer 2 broadcast domain boundary","Because routers copy broadcasts into every subnet","Because CAM tables convert broadcasts into unicasts","Because DHCP scopes block broadcast frames","A","A VLAN is a Layer 2 broadcast domain so broadcasts normally stay inside it.","vlan","broadcast containment","/home/citadel/Documents/citavault/NETC-121/rocket-questions-html/courses/NETC-121/notes-content/Notes List D - Alex's Final Exam Preparation/STUDY GUIDE 1.md"
"hard","A host receives a DHCP Offer after sending Discover. What is the next DORA step from the client?","Acknowledge","Release","Request","Discover again","C","After Offer the client sends Request in the DORA process.","dhcp dora","offer to request","/home/citadel/Documents/citavault/NETC-121/rocket-questions-html/courses/NETC-121/notes-content/Notes List D - Alex's Final Exam Preparation/STUDY GUIDE 1.md"
"hard","Which bridge-role description best matches the guide's use of the term root bridge?","The switch chosen as the central STP reference based on bridge ID","The switch with the highest VLAN number","The router that provides the default route","The switch with the largest CAM table","A","The root bridge is the STP reference switch chosen by bridge ID.","stp","root bridge deeper","/home/citadel/Documents/citavault/NETC-121/rocket-questions-html/courses/NETC-121/notes-content/Notes List D - Alex's Final Exam Preparation/STUDY GUIDE 1.md"
"hard","What characteristic best defines the root port on a non-root switch?","It is the port with the best path toward the root bridge","It is always the port with the highest number","It is the port that carries the native VLAN","It is permanently disabled to prevent loops","A","The root port is the port with the best path toward the root bridge.","stp","root port deeper","/home/citadel/Documents/citavault/NETC-121/rocket-questions-html/courses/NETC-121/notes-content/Notes List D - Alex's Final Exam Preparation/STUDY GUIDE 1.md"
"hard","What characteristic best defines a designated port in STP?","It is the forwarding port chosen for a network segment","It is the default gateway for a VLAN","It is the only port that can send ARP","It is the administrative console port","A","A designated port is the forwarding port chosen for a network segment.","stp","designated port deeper","/home/citadel/Documents/citavault/NETC-121/rocket-questions-html/courses/NETC-121/notes-content/Notes List D - Alex's Final Exam Preparation/STUDY GUIDE 1.md"
"hard","Why is a blocked STP port still useful even though it does not forward user traffic?","It remains available to prevent loops and can participate in topology control","It provides DNS replies for the VLAN","It stores DHCP scopes for the switch","It becomes the default route automatically","A","A blocked port still serves STP topology control and helps prevent loops.","stp","blocked port value","/home/citadel/Documents/citavault/NETC-121/rocket-questions-html/courses/NETC-121/notes-content/Notes List D - Alex's Final Exam Preparation/STUDY GUIDE 1.md"
"hard","Which statement best summarizes the two broad functions of a Layer 3 switch?","It repeats bits and terminates fiber","It switches frames and routes packets","It assigns hostnames and subnet masks","It encrypts traffic and resolves names","B","A Layer 3 switch can switch frames and route packets.","layer 3 switch","combined functions deeper","/home/citadel/Documents/citavault/NETC-121/rocket-questions-html/courses/NETC-121/notes-content/Notes List D - Alex's Final Exam Preparation/STUDY GUIDE 1.md"
"hard","Why can a host send directly to another device on the same subnet without using the default gateway?","Because the host can resolve the destination MAC and deliver the frame locally","Because DHCP disables routing on that subnet","Because the default route is ignored whenever the subnet mask is /24","Because the trunk port forwards every frame automatically","A","For same-subnet traffic the host can resolve the destination MAC and send locally.","routing situations","same subnet local delivery","/home/citadel/Documents/citavault/NETC-121/rocket-questions-html/courses/NETC-121/notes-content/Notes List D - Alex's Final Exam Preparation/STUDY GUIDE 1.md"
"hard","Why must a host compare the destination with its own subnet information before sending traffic?","To decide whether to send directly or use the default gateway","To choose the STP root bridge","To build a CAM table entry","To assign the native VLAN","A","A host compares destination and subnet information to decide whether traffic is local or remote.","routing situations","local versus remote decision","/home/citadel/Documents/citavault/NETC-121/rocket-questions-html/courses/NETC-121/notes-content/Notes List D - Alex's Final Exam Preparation/STUDY GUIDE 1.md"
"hard","What kind of line in the guide can generate several related subnetting questions by itself?","A line about the weather","A line listing network ID broadcast address subnet mask and usable host range","A line listing only the course name","A line describing window size","B","The subnetting checklist can generate multiple separate questions because each item is testable.","subnetting","multiple quiz targets","/home/citadel/Documents/citavault/NETC-121/rocket-questions-html/courses/NETC-121/notes-content/Notes List D - Alex's Final Exam Preparation/STUDY GUIDE 1.md"
"medium","What is the main advantage of using a Layer 3 switch for inter-VLAN communication inside a campus network?","It can route between VLANs while still performing normal Layer 2 switching","It removes the need for IP addresses","It turns all access ports into trunks","It prevents all broadcasts on every VLAN","A","A Layer 3 switch can route between VLANs while still performing normal Layer 2 switching.","layer 3 switch","campus inter-vlan use","/home/citadel/Documents/citavault/NETC-121/rocket-questions-html/courses/NETC-121/notes-content/Notes List D - Alex's Final Exam Preparation/STUDY GUIDE 1.md"
"medium","Why is multicast more bandwidth-efficient than broadcast when only a subset of receivers needs the traffic?","Because multicast reaches only the interested group instead of every host in the broadcast domain","Because multicast never uses IP addresses","Because multicast replaces routing tables","Because multicast disables switching loops","A","Multicast is more efficient because it reaches only the intended group rather than every host in the broadcast domain.","traffic types","multicast efficiency","/home/citadel/Documents/citavault/NETC-121/rocket-questions-html/courses/NETC-121/notes-content/Notes List D - Alex's Final Exam Preparation/STUDY GUIDE 1.md"
"medium","Which statement best describes why routers separate broadcast domains?","Routers forward frames based on MAC addresses only","Routers operate at Layer 3 and do not forward Layer 2 broadcasts between subnets","Routers replace every ARP table with a CAM table","Routers treat every subnet as one large VLAN","B","Routers operate at Layer 3 and do not forward Layer 2 broadcasts between subnets.","routing fundamentals","broadcast domain separation","/home/citadel/Documents/citavault/NETC-121/rocket-questions-html/courses/NETC-121/notes-content/Notes List D - Alex's Final Exam Preparation/STUDY GUIDE 1.md"
"hard","Which statement best distinguishes RIP from OSPF at a high level?","RIP is distance-vector and OSPF is link-state","RIP is link-state and OSPF is distance-vector","Both are MAC-based switching protocols","Both are DHCP extensions","A","RIP is distance-vector while OSPF is link-state.","routing protocols","rip versus ospf","/home/citadel/Documents/citavault/NETC-121/rocket-questions-html/courses/NETC-121/notes-content/Notes List D - Alex's Final Exam Preparation/STUDY GUIDE 1.md"
"hard","What is the practical effect of summarizing several contiguous routes into one advertisement?","Routers can carry a smaller and cleaner view of reachable networks","Every host gains more usable addresses","STP no longer needs a root bridge","VLAN tags are removed from trunks","A","Summarization lets routers carry a smaller and cleaner view of reachable networks.","route summarization","advertisement effect","/home/citadel/Documents/citavault/NETC-121/rocket-questions-html/courses/NETC-121/notes-content/Notes List D - Alex's Final Exam Preparation/STUDY GUIDE 1.md"
"hard","Why does an access port normally send endpoint traffic untagged even in a VLAN environment?","Because the switch handles VLAN membership internally for the endpoint-facing link","Because endpoints can never use IP addresses","Because untagged traffic automatically becomes multicast","Because access ports do not belong to VLANs","A","Access ports normally send endpoint traffic untagged because the switch handles the VLAN membership internally for that endpoint-facing link.","trunking","access port untagged behavior","/home/citadel/Documents/citavault/NETC-121/rocket-questions-html/courses/NETC-121/notes-content/Notes List D - Alex's Final Exam Preparation/STUDY GUIDE 1.md"
